type,date,score,sentences,place,latitude,longitude,feature_type,admin1_name,admin2_name,country_name,school,place_type,action,corrected_name,corrected_latlon,corrected_place_type,reviewer,place_count
comment,2025-10-01,16,"Search for Richmond's 'very special' feline goes viral](https://www.wtvr.com/news/local-news/search-for-francine-famous-lowes-cat-richmond-virginia-sept-28-2025)

[Richmond's famous Lowe's cat, Francine, goes national - Axios Richmond](https://www.axios.com/local/richmond/2024/10/22/richmond-lowes-home-improvement-famous-cat-francine)

I finally got to meet her earlier this year (after many trips to that Lowes) and hope they are able to bring her back to her home safely, she is a sweet little thing...",Richmond,37.55376,-77.46026,seat of a first-order administrative division,Virginia,City of Richmond,United States,VCU,City,,,,,,183
comment,2025-10-01,16,"Search for Richmond's 'very special' feline goes viral](https://www.wtvr.com/news/local-news/search-for-francine-famous-lowes-cat-richmond-virginia-sept-28-2025)

[Richmond's famous Lowe's cat, Francine, goes national - Axios Richmond](https://www.axios.com/local/richmond/2024/10/22/richmond-lowes-home-improvement-famous-cat-francine)

I finally got to meet her earlier this year (after many trips to that Lowes) and hope they are able to bring her back to her home safely, she is a sweet little thing...",Richmond,37.55376,-77.46026,seat of a first-order administrative division,Virginia,City of Richmond,United States,VCU,City,,,,,,183
post,2025-02-03,154,We the People reject Project 2025 Peaceful protest at capital square on Feb 5th!,Capital Square Industrial Park,41.29722,-81.51278,square,Ohio,Summit County,United States,VCU,Building,,,,,,1
comment,2025-02-03,14,"I shared this in the Megathread in the r/rva subreddit, but if you go to this thing you will be able to hear the VCU Siren Test that starts at Noon on the 5th because the Medical Campus is right next to the Virginia State Capital, so don't freak out...

Megathread: [For your awareness: There is a protest planned 2/5/25 at the Virginia Capitol : r/rva](https://www.reddit.com/r/rva/comments/1igphu5/for_your_awareness_there_is_a_protest_planned/)",The Medical Center Columbus Regional Campus,32.48044,-84.98242,hospital,Georgia,Muscogee County,United States,VCU,Building,,,,,,1
comment,2025-02-04,1,"\#1: [HUGE la protest right now](https://i.redd.it/rm84igw4gsge1.jpeg) | [537 comments](https://np.reddit.com/r/50501/comments/1ig79dd/huge_la_protest_right_now/)  
\#2: [Protest Right Now in Chicago outside Trump Tower](https://i.redd.it/04q0u6h0tzge1.jpeg) | [254 comments](https://np.reddit.com/r/50501/comments/1ih0o78/protest_right_now_in_chicago_outside_trump_tower/)  
\#3: [Fed worker here](https://np.reddit.com/r/50501/comments/1ifxz5a/fed_worker_here/)

----
^^I'm ^^a ^^bot, ^^beep ^^boop ^^| ^^Downvote ^^to ^^remove ^^| ^^[Contact](https://www.reddit.com/message/compose/?to=sneakpeekbot) ^^| ^^[Info](https://np.reddit.com/r/sneakpeekbot/) ^^| ^^[Opt-out](https://np.reddit.com/r/sneakpeekbot/comments/o8wk1r/blacklist_ix/) ^^| ^^[GitHub](https://github.com/ghnr/sneakpeekbot)",Chicago,41.85003,-87.65005,seat of a second-order administrative division,Illinois,Cook County,United States,VCU,City,,,,,,3
comment,2025-02-05,1,The unemployment rate in Richmond is lower than the national average.,Richmond,37.55376,-77.46026,seat of a first-order administrative division,Virginia,City of Richmond,United States,VCU,City,,,,,,183
post,2024-10-16,159,He was already speaking to a girl who looked uncomfortable as I walked past in Monroe park.,Monroe County,35.44265,-84.25279,second-order administrative division,Tennessee,Monroe County,United States,VCU,State,,,,,,4
post,2024-10-16,159,once I turned the corner on broad I began to run to put some space between us.,Broad,53.56733,-6.7802,locality,Leinster,Meath,Ireland,VCU,City,,,,,,9
comment,2024-10-16,61,There's a little VCU police office on Grace next to Au Bon Pain.,Grace,13.78164,-60.96863,populated place,Vieux-Fort,Grace,Saint Lucia,VCU,City,,,,,,1
comment,2024-10-16,61,There's an apartment building full of old people on Grace.,Notre-Dame-de-Grâce,47.48738,-1.9275,populated place,Pays de la Loire,Loire-Atlantique,France,VCU,City,,,,,,3
comment,2024-10-17,4,i was by myself meeting friends at the known thrift store around vcu (im not sure of the name but im pretty sure its rumors).,VCU Massey Cancer Center,37.53926,-77.42868,hospital,Virginia,City of Richmond,United States,VCU,Building,,,,,,15
comment,2024-10-17,4,"i was walking from my dorm, gladding residence center, around 4pm i think and as im passing monroe park i saw that man AGAIN, with that description, about late 50's to 60's im assuming, he stared at me literally just staring into my soul and he started walking the direction i was going.",Monroe Park,25.72955,-80.24533,park,Florida,Miami-Dade County,United States,VCU,Neighborhood,,,,,,29
comment,2024-10-17,4,he lingers around monroe park like around the outside of the park.,Monroe Park,25.72955,-80.24533,park,Florida,Miami-Dade County,United States,VCU,Neighborhood,,,,,,29
comment,2024-10-17,4,"As someone who lived in NYC , some guy was taking pics of me on the subway once.",New York City,40.71427,-74.00597,populated place,New York,,United States,VCU,City,,,,,,7
comment,2024-10-17,2,Is there still a police station in the building in the center of Monroe Park?,Monroe Park,25.72955,-80.24533,park,Florida,Miami-Dade County,United States,VCU,Neighborhood,,,,,,29
comment,2024-10-16,8,It's called Dominion Place and it's low income housing.,Dominion Place,37.55154,-77.45415,building(s),Virginia,City of Richmond,United States,VCU,Building,,,,,,1
comment,2024-10-16,8,Laurel and Broad is a bit afar for most residents.,Laurel Beach,41.18288,-73.09372,populated place,Connecticut,South Central Connecticut Planning Region,United States,VCU,City,,,,,,1
comment,2024-10-16,8,Laurel and Broad is a bit afar for most residents.,Broad,53.56733,-6.7802,locality,Leinster,Meath,Ireland,VCU,City,,,,,,9
comment,2020-07-27,56,"The sad part is, the same goes for almost every for profit college in the USA.",United States,39.76,-98.5,independent political entity,,,United States,VCU,Country,,,,,,51
comment,2020-07-27,19,"""aha nooo wont somebody think of the windows feelings :( ?""",Picturesque Windows,37.05443,-111.87295,arch,Utah,Kane County,United States,VCU,Natural Feature,,,,,,2
comment,2020-07-27,19,"its fucking something else man, god forbid someone hurts the precious windows feelings",Picturesque Windows,37.05443,-111.87295,arch,Utah,Kane County,United States,VCU,Natural Feature,,,,,,2
comment,2020-07-27,-7,Richmond is in a shitty place right now and nobody is going to want to come to college here with what’s going on.,Richmond,39.82894,-84.89024,seat of a second-order administrative division,Indiana,Wayne County,United States,VCU,City,,,,,,7
comment,2020-08-01,1,BLM757 led the crowd into monroe park and out of it but once people found out who they were they dispersed and did their own thing.,Monroe Park,25.72955,-80.24533,park,Florida,Miami-Dade County,United States,VCU,Neighborhood,,,,,,29
comment,2020-07-27,19,Richmond is not a shitty place.,Richmond,37.93576,-122.34775,populated place,California,Contra Costa County,United States,VCU,City,,,,,,4
comment,2020-07-27,17,VCU as an institution has done great harm to the minority communities in Richmond so pardon me if I don’t care at all that someone broke a couple of their windows and turned a few of their trash cans upside down.,Richmond,37.55376,-77.46026,seat of a first-order administrative division,Virginia,City of Richmond,United States,VCU,City,,,,,,183
comment,2020-07-27,-3,"1/ [Nice Lie buddy](https://imgur.com/gallery/DlHk9fQ)

2/Have you even walked down Broad street in the past month?",Broad Street,51.51605,-0.08601,section of populated place,England,Greater London,United Kingdom,VCU,Neighborhood,,,,,,3
comment,2020-07-28,1,"Additionally, he brought a fucking halberd to the UTR rally in Charlottesville.",Charlottesville,38.02931,-78.47668,seat of a second-order administrative division,Virginia,City of Charlottesville,United States,VCU,City,,,,,,6
comment,2020-07-27,10,"Just to hammer my point home that Richmond isn’t “going to shit” and that you’re an idiot who has no idea what he’s talking about, here’s an article from the local news: [Police say Richmond riots were instigated by White Supremacists disguised as BLM](https://www.wsls.com/news/virginia/2020/07/27/police-richmond-riots-instigated-by-white-supremacists-disguised-as-black-lives-matter/) .",Richmond,37.55376,-77.46026,seat of a first-order administrative division,Virginia,City of Richmond,United States,VCU,City,,,,,,183
comment,2020-07-27,10,"Just to hammer my point home that Richmond isn’t “going to shit” and that you’re an idiot who has no idea what he’s talking about, here’s an article from the local news: [Police say Richmond riots were instigated by White Supremacists disguised as BLM](https://www.wsls.com/news/virginia/2020/07/27/police-richmond-riots-instigated-by-white-supremacists-disguised-as-black-lives-matter/) .",Richmond,37.55376,-77.46026,seat of a first-order administrative division,Virginia,City of Richmond,United States,VCU,City,,,,,,183
comment,2020-07-27,10,"Just to hammer my point home that Richmond isn’t “going to shit” and that you’re an idiot who has no idea what he’s talking about, here’s an article from the local news: [Police say Richmond riots were instigated by White Supremacists disguised as BLM](https://www.wsls.com/news/virginia/2020/07/27/police-richmond-riots-instigated-by-white-supremacists-disguised-as-black-lives-matter/) .",Richmond,37.55376,-77.46026,seat of a first-order administrative division,Virginia,City of Richmond,United States,VCU,City,,,,,,183
comment,2020-07-27,7,"i could go on, but i'm sure your hyperconfident 19 year old white dude business major self will have some artfully crafted rebuttal pulled wholesale from a breitbart writer who thinks the VA is socialist and communism is when the government does things (bad things), so really: ultimately all that really matters here is that people like you aren't wanted at VCU or in Richmond.",Virginia,37.54812,-77.44675,first-order administrative division,Virginia,,United States,VCU,State,,,,,,58
comment,2020-07-27,7,"i could go on, but i'm sure your hyperconfident 19 year old white dude business major self will have some artfully crafted rebuttal pulled wholesale from a breitbart writer who thinks the VA is socialist and communism is when the government does things (bad things), so really: ultimately all that really matters here is that people like you aren't wanted at VCU or in Richmond.",Richmond,37.55376,-77.46026,seat of a first-order administrative division,Virginia,City of Richmond,United States,VCU,City,,,,,,183
comment,2020-07-27,8,Riots are a legitimate form of protest in America.,United States,39.76,-98.5,independent political entity,,,United States,VCU,Country,,,,,,51
comment,2020-07-27,-6,All of the reasonable people in America see the destruction of these cities and the local governments allowing it to happen and they will vote accordingly.,United States,39.76,-98.5,independent political entity,,,United States,VCU,Country,,,,,,51
comment,2020-08-07,14,But prolly something immediate I’d do is just apply to grad school in japan and pay all the tuition and housing up front and be set.,Japan,35.68536,139.75309,independent political entity,,,Japan,VCU,Country,,,,,,2
comment,2022-06-28,21,Wow I had assumed that art building on Broad in the first slide was historic from the style.,Broad,53.56733,-6.7802,locality,Leinster,Meath,Ireland,VCU,City,,,,,,9
comment,2022-06-29,10,"While VCU does have its issues, I am genuinely grateful for how much they revitalized Richmond and made it a good place to live.",Richmond,37.55376,-77.46026,seat of a first-order administrative division,Virginia,City of Richmond,United States,VCU,City,,,,,,183
comment,2022-06-29,2,Wait til you check out Grace Street,Grace Street House,38.44167,-78.87528,building(s),Virginia,City of Harrisonburg,United States,VCU,Building,,,,,,10
comment,2022-06-28,-2,This just makes me miss late 00s Richmond even more than I already do,Richmond,37.55376,-77.46026,seat of a first-order administrative division,Virginia,City of Richmond,United States,VCU,City,,,,,,183
comment,2022-06-29,1,Then I went and did the same thing with my house/street in Oregon Hill to see how it’s changed over the years!,Oregon Hill,42.28255,-117.06096,mountain,Oregon,Malheur County,United States,VCU,Natural Feature,,,,,,4
comment,2022-06-28,6,And [this photo gallery from the RTD](https://richmond.com/news/local/history/from-the-archives-65-photos-of-richmond-in-the-1930s/collection_2b03c705-bd27-5e60-a89c-57d3ce1960b5.html#48) has a nice picture of it from 1938.,Richmond,37.55376,-77.46026,seat of a first-order administrative division,Virginia,City of Richmond,United States,VCU,City,,,,,,183
post,2025-11-05,147,Congrats to VCU for reaching the NYC Mayoral Home,New York City,40.71427,-74.00597,populated place,New York,,United States,VCU,City,,,,,,7
post,2025-03-18,142,New Wingstop on Broad and Shafer Please be on the dining plan next year,Broad,53.56733,-6.7802,locality,Leinster,Meath,Ireland,VCU,City,,,,,,9
comment,2025-03-20,1,I hope they’re good like the one in White Oaks,White Oaks,41.50343,-73.21122,,Connecticut,,United States,VCU,,,,,,,1
comment,2025-03-19,10,The rats of Monroe are gonna have a field day,Monroe County,35.44265,-84.25279,second-order administrative division,Tennessee,Monroe County,United States,VCU,State,,,,,,4
comment,2024-05-12,-14,At my department ceremony there were some people that wore some free Palestine stuff and they walked the stage and that was that.,Palestine,31.92157,35.20329,semi-independent political entity,,,Palestinian Territory,VCU,Country,,,,,,25
comment,2024-05-12,36,I read an article recently noting that the Palestinians are aware of US students protesting on their behalf and it means a lot to them.,United States,39.76,-98.5,independent political entity,,,United States,VCU,Country,,,,,,51
comment,2024-05-12,1,"It’s not like you live in Cali, you’re within 2 hours from the capital.",Derbent,42.06622,48.28759,seat of a second-order administrative division,Dagestan,,Russia,VCU,City,,,,,,1
post,2025-09-21,141,Ive been usually just walking him in between the Singleton and James music buildings and letting him get a feel for the outside.,Great Singleton,53.83333,-2.93333,populated place,England,Lancashire,United Kingdom,VCU,City,,,,,,1
comment,2025-04-09,1,LOOK AT US GO,United States,39.76,-98.5,independent political entity,,,United States,VCU,Country,,,,,,51
comment,2020-09-25,1,"Le Mans
4.",Le Mans,48.0021,0.20251,seat of a second-order administrative division,Pays de la Loire,Sarthe,France,VCU,City,,,,,,1
comment,2026-01-29,2,Anyone know part time jobs hiring around Vcu?,VCU Massey Cancer Center,37.53926,-77.42868,hospital,Virginia,City of Richmond,United States,VCU,Building,,,,,,15
comment,2024-05-01,8,"VCU, VA Police and Richmond city police were the attackers at yesterday’s peaceful protest.",Virginia,37.54812,-77.44675,first-order administrative division,Virginia,,United States,VCU,State,,,,,,58
comment,2024-05-01,8,"VCU, VA Police and Richmond city police were the attackers at yesterday’s peaceful protest.",Richmond,37.55376,-77.46026,seat of a first-order administrative division,Virginia,City of Richmond,United States,VCU,City,,,,,,183
comment,2024-04-30,-2,"Columbia University, Colombia is the South American country.",Colombia,4.66049,-74.06757,section of populated place,Bogota D.C.,Bogotá  D.C.,Colombia,VCU,Neighborhood,,,,,,1
comment,2024-05-01,3,Richmond doesn’t have a curfew.,Richmond County,33.35963,-82.07355,second-order administrative division,Georgia,Richmond County,United States,VCU,State,,,,,,1
comment,2020-08-31,62,"One thing I'll say is that, during a pandemic everyone is already way out of their comfort zones and super confused WHY WOULD YOU TRY TO SWITCH TO CANVAS RIGHT NOW?!",Canvas,38.26844,-80.77426,populated place,West Virginia,Nicholas County,United States,VCU,City,,,,,,3
comment,2020-08-31,27,I graduated some years ago but I’m a Richmond native and inner city resident so I still follow this sub.,Richmond,37.55376,-77.46026,seat of a first-order administrative division,Virginia,City of Richmond,United States,VCU,City,,,,,,183
comment,2020-09-01,4,Just FYI the change to Canvas was scheduled and happening long before the pandemic started.,Canvas,38.26844,-80.77426,populated place,West Virginia,Nicholas County,United States,VCU,City,,,,,,3
comment,2025-09-20,23,I have dropped an ID in the past at VCU’s police station on Grace.,Grace,39.43065,-78.71335,populated place,West Virginia,Hampshire County,United States,VCU,City,,,,,,2
comment,2025-09-20,6,"Isn't he Marco's cousin, the one from Tropoja?",Rrethi i Tropojës,42.3995,20.16283,historical second-order administrative division,Kukës County,,Albania,VCU,State,,,,,,1
comment,2025-09-20,-3,I don’t even live in Richmond.,Richmond,37.55376,-77.46026,seat of a first-order administrative division,Virginia,City of Richmond,United States,VCU,City,,,,,,183
comment,2025-09-21,1,Apparently doesn't even go to vcu or live in rva!,VCU Massey Cancer Center,37.53926,-77.42868,hospital,Virginia,City of Richmond,United States,VCU,Building,,,,,,15
comment,2025-09-21,1,Apparently doesn't even go to vcu or live in rva!,Farafangana,-22.82223,47.82615,seat of a first-order administrative division,Atsimo-Atsinanana,Farafangana District,Madagascar,VCU,City,,,,,,21
comment,2021-04-07,21,I hate the fact that he came to Richmond for opportunity and to live his dreams out and this is how we respond.,Richmond,37.55376,-77.46026,seat of a first-order administrative division,Virginia,City of Richmond,United States,VCU,City,,,,,,183
comment,2021-04-06,48,"For all of the folks worried about fear-mongering, it’s okay to be realistic, Richmond at the moment is not as safe as it was a few years ago.",Richmond,37.55376,-77.46026,seat of a first-order administrative division,Virginia,City of Richmond,United States,VCU,City,,,,,,183
comment,2021-04-07,9,Richmond pd don’t seem to be too interested in catching these guys though.,Richmond,39.82894,-84.89024,seat of a second-order administrative division,Indiana,Wayne County,United States,VCU,City,,,,,,7
comment,2021-04-06,38,Richmond's crime numbers are lower if not the same as most cities of similar size.,Richmond,37.55376,-77.46026,seat of a first-order administrative division,Virginia,City of Richmond,United States,VCU,City,,,,,,183
comment,2021-04-06,17,I thought Richmond was unsafe and then I moved to a slightly bigger city and it definitely is not as long as you use basic street smarts.,Richmond,37.55376,-77.46026,seat of a first-order administrative division,Virginia,City of Richmond,United States,VCU,City,,,,,,183
comment,2021-04-06,18,Yeah whenever someone says Richmond is dangerous they get downvoted so hard.,Richmond,37.55376,-77.46026,seat of a first-order administrative division,Virginia,City of Richmond,United States,VCU,City,,,,,,183
comment,2021-04-06,18,People don’t wanna acknowledge it but Richmond isn’t that safe.,Richmond,37.55376,-77.46026,seat of a first-order administrative division,Virginia,City of Richmond,United States,VCU,City,,,,,,183
comment,2021-04-07,0,if u think rva is dangerous ur definitely from some super safe nova suburb,Novo,55.9288,42.9213,populated place,Nizhny Novgorod Oblast,,Russia,VCU,City,,,,,,1
comment,2021-04-06,5,"If once a week my lab gets out at 850pm, from harris to bnb dorm is that considered safe to walk without ramsafe?",Harris,41.81399,-71.312,populated place,Massachusetts,Bristol County,United States,VCU,City,,,,,,1
comment,2021-04-07,12,"Considering the police immediately pinned it on drugs when the young black male was killed the day before not 20 feet from Cody, and didn’t think it necessary to patrol at least the day after.",Cody,49.96657,-117.20219,populated locality,British Columbia,Regional District of Central Kootenay,Canada,VCU,City,,,,,,1
comment,2023-01-27,18,I saw someone literally swerving their car all around Cary street in broad daylight like it was nothing,Cary,42.21197,-88.23814,populated place,Illinois,McHenry County,United States,VCU,City,,,,,,2
comment,2023-01-28,6,"I agree, myself having been in an accident in the Cary St parking deck because someone was speeding and on their phone.",Best Western Plus Cary - Nc St,35.7623,-78.7476,hotel,North Carolina,Wake County,United States,VCU,Building,,,,,,4
comment,2023-01-28,5,I recently moved to richmond this month and one thing that always confused me was some of the traffic patterns and the pedestrian traffic lights in the city.,Richmond,51.46171,-0.30633,populated place,England,Greater London,United Kingdom,VCU,City,,,,,,10
comment,2023-01-28,5,"Not sure how it works in the monroe campus, but at the MCV campus we have a crosswalk behind VCU hospital on marshall street, near Hunton's student center and VCU medical school.",Monroe County,37.56037,-80.55055,second-order administrative division,West Virginia,Monroe County,United States,VCU,State,,,,,,4
comment,2023-01-28,5,"Not sure how it works in the monroe campus, but at the MCV campus we have a crosswalk behind VCU hospital on marshall street, near Hunton's student center and VCU medical school.",Marshall Street,-33.85652,151.18494,street,New South Wales,Inner West,Australia,VCU,Road,,,,,,1
comment,2023-01-28,5,"Not sure how it works in the monroe campus, but at the MCV campus we have a crosswalk behind VCU hospital on marshall street, near Hunton's student center and VCU medical school.",Hunton,37.68848,-77.49971,populated place,Virginia,Henrico County,United States,VCU,City,,,,,,1
comment,2023-01-28,5,My classes are down that same street in Kontos and the Egyptian building.,Káto Kryfovó,39.51383,20.89908,populated place,Epirus,Nomós Ioannínon,Greece,VCU,City,,,,,,1
comment,2023-01-28,5,VCU gateway is literally a disaster waiting to happen.,VCU Massey Cancer Center,37.53926,-77.42868,hospital,Virginia,City of Richmond,United States,VCU,Building,,,,,,15
comment,2023-01-28,5,I am from chesterfield county.,Chesterfield County,34.63978,-80.15872,second-order administrative division,South Carolina,Chesterfield County,United States,VCU,State,,,,,,1
comment,2023-01-28,5,It takes longer to make a left turn in chesterfield but at least it is safer.,Chesterfield,52.64922,-1.85184,populated place,England,Staffordshire,United Kingdom,VCU,City,,,,,,3
comment,2023-01-28,5,"In richmond, you could have a green light to turn left but you have to yield to opposing traffic, and the lane you are turning on, pedestrians may have the signal to cross the road.",Richmond,37.55376,-77.46026,seat of a first-order administrative division,Virginia,City of Richmond,United States,VCU,City,,,,,,183
comment,2023-01-28,3,Leaving the gym yesterday and I saw someone turn on to Cary in the opposite direction of traffic.,Cary,42.21197,-88.23814,populated place,Illinois,McHenry County,United States,VCU,City,,,,,,2
comment,2023-01-28,2,"As a driver there is no reason somebody has to he on Main between Cherry and Harrison, or on Floyd between Harrison & Laurel",Main,36.10503,-104.28637,,New Mexico,Harding County,United States,VCU,,,,,,,1
comment,2023-01-28,2,"As a driver there is no reason somebody has to he on Main between Cherry and Harrison, or on Floyd between Harrison & Laurel",Cherry,35.67675,-89.70841,populated place,Tennessee,Lauderdale County,United States,VCU,City,,,,,,2
comment,2023-01-28,2,"As a driver there is no reason somebody has to he on Main between Cherry and Harrison, or on Floyd between Harrison & Laurel",Scranton,41.40916,-75.6649,seat of a second-order administrative division,Pennsylvania,Lackawanna County,United States,VCU,City,,,,,,2
comment,2023-01-28,2,"As a driver there is no reason somebody has to he on Main between Cherry and Harrison, or on Floyd between Harrison & Laurel",Floyd,32.67763,-91.40595,populated place,Louisiana,West Carroll Parish,United States,VCU,City,,,,,,1
comment,2023-01-28,2,"As a driver there is no reason somebody has to he on Main between Cherry and Harrison, or on Floyd between Harrison & Laurel",Scranton,41.40916,-75.6649,seat of a second-order administrative division,Pennsylvania,Lackawanna County,United States,VCU,City,,,,,,2
comment,2023-01-28,2,"As a driver there is no reason somebody has to he on Main between Cherry and Harrison, or on Floyd between Harrison & Laurel",Kingwood,40.26259,-76.95525,populated place,Pennsylvania,Cumberland County,United States,VCU,City,,,,,,2
comment,2023-01-28,1,We've lost students going home to people who aren't even from the central vcu area.,VCU Massey Cancer Center,37.53926,-77.42868,hospital,Virginia,City of Richmond,United States,VCU,Building,,,,,,15
comment,2023-01-28,2,Except for delivery drivers and anyone who lives in Oregon Hill....,Oregon Hill,42.28255,-117.06096,mountain,Oregon,Malheur County,United States,VCU,Natural Feature,,,,,,4
comment,2023-01-31,4,I don’t get why so many Richmond drivers can’t comprehend the idea of waiting,Richmond,37.55376,-77.46026,seat of a first-order administrative division,Virginia,City of Richmond,United States,VCU,City,,,,,,183
comment,2023-01-29,1,And is also a busy St.,St.,58.73488,5.64929,railroad station,Rogaland,Time,Norway,VCU,Road,,,,,,1
comment,2025-09-16,4,I used to work on MCV and used the 8th street parking deck.,Here’s Your Chance Mine,-16.4333,136.0667,mine(s),Northern Territory,Roper Gulf,Australia,VCU,Building,,,,,,1
