type,date,score,sentences,place,latitude,longitude,feature_type,admin1_name,admin2_name,country_name,school,place_type,action,corrected_name,corrected_latlon,corrected_place_type,reviewer,place_count
comment,2020-05-12,4,"As mentioned, the best things about Richmond have nothing to do with VCU, like the river and the trail system.",Richmond,37.55376,-77.46026,seat of a first-order administrative division,Virginia,City of Richmond,United States,VCU,City,,,,,,183
comment,2020-05-12,7,Plus I used to love coming to Richmond before I moved there and realized how much it sucks to be there everyday.,Richmond,37.55376,-77.46026,seat of a first-order administrative division,Virginia,City of Richmond,United States,VCU,City,,,,,,183
comment,2020-05-19,2,I love the city of Richmond.,Richmond,37.55376,-77.46026,seat of a first-order administrative division,Virginia,City of Richmond,United States,VCU,City,,,,,,183
comment,2020-05-19,2,I think what makes VCU so different is Richmond itself.,Richmond,37.55376,-77.46026,seat of a first-order administrative division,Virginia,City of Richmond,United States,VCU,City,,,,,,183
comment,2020-05-19,2,The creativity and bursts of art and colors in Richmond is what attracted me to this school in the first place (vcu was my top choice).,Richmond,37.55376,-77.46026,seat of a first-order administrative division,Virginia,City of Richmond,United States,VCU,City,,,,,,183
comment,2020-05-12,1,I spend every weekend back in Nova hanging at GMU.,Nõva,59.21639,23.6725,populated place,Lääne,Lääne-Nigula vald,Estonia,VCU,City,,,,,,3
comment,2020-05-12,4,"I grew up in Alaska, Alaska is very big in to sports and there isn’t much of anything else to do.",Alaska,64.00028,-150.00028,first-order administrative division,Alaska,,United States,VCU,State,,,,,,4
comment,2020-05-12,4,"I grew up in Alaska, Alaska is very big in to sports and there isn’t much of anything else to do.",Alaska,64.00028,-150.00028,first-order administrative division,Alaska,,United States,VCU,State,,,,,,4
comment,2023-06-11,1,"VCU has done a lot to clean up the areas that it calls home, but the school's presence does not change the culture and intimacy of Richmond, it only tarnishes it.",Richmond,37.55376,-77.46026,seat of a first-order administrative division,Virginia,City of Richmond,United States,VCU,City,,,,,,183
comment,2023-06-11,1,"This creates a connected and community based school spirit that can't be shaken because you are immersed almost 24/7

In conclusion your experience at VCU has nothing to do with Richmond as a whole.",Richmond,37.55376,-77.46026,seat of a first-order administrative division,Virginia,City of Richmond,United States,VCU,City,,,,,,183
comment,2020-05-12,7,"Also, being in RVA kinda dampens school spirit when comparing it to other schools in the state.",Farafangana,-22.82223,47.82615,seat of a first-order administrative division,Atsimo-Atsinanana,Farafangana District,Madagascar,VCU,City,,,,,,21
comment,2020-05-12,9,"VT, UVA and JMU have almost no commuters though you're right about that.",Vermont,44.00034,-72.74983,first-order administrative division,Vermont,,United States,VCU,State,,,,,,4
comment,2020-05-12,9,"VT, UVA and JMU have almost no commuters though you're right about that.",Uvalde,29.20968,-99.78617,seat of a second-order administrative division,Texas,Uvalde County,United States,VCU,City,,,,,,1
comment,2020-05-12,9,"VT, UVA and JMU have almost no commuters though you're right about that.",Jiamusi,46.79711,130.31118,seat of a second-order administrative division,Heilongjiang,Jiamusi Shi,China,VCU,City,,,,,,2
comment,2022-06-11,1,I also grew up in Alaska.,Alaska,64.00028,-150.00028,first-order administrative division,Alaska,,United States,VCU,State,,,,,,4
comment,2024-02-14,1,Not VCU’s fault Richmond doesn’t incentivize other investors to come in and buy property.,Richmond,37.55376,-77.46026,seat of a first-order administrative division,Virginia,City of Richmond,United States,VCU,City,,,,,,183
comment,2024-02-14,1,Richmond has a lot of issues that are just Richmond’s so it feels weird to claim that VCU’s tarnishing the city.,Richmond,37.55376,-77.46026,seat of a first-order administrative division,Virginia,City of Richmond,United States,VCU,City,,,,,,183
comment,2024-02-14,1,Richmond has a lot of issues that are just Richmond’s so it feels weird to claim that VCU’s tarnishing the city.,Richmond,37.55376,-77.46026,seat of a first-order administrative division,Virginia,City of Richmond,United States,VCU,City,,,,,,183
comment,2024-02-14,1,"And quite honestly only four parts of Richmond, downtown, the fan, and VCU campus because that’s where money’s being spent",Richmond,37.55376,-77.46026,seat of a first-order administrative division,Virginia,City of Richmond,United States,VCU,City,,,,,,183
comment,2020-05-12,1,"But even then, people went back to Nova or wherever on weekends.",Nõva,59.21639,23.6725,populated place,Lääne,Lääne-Nigula vald,Estonia,VCU,City,,,,,,3
post,2026-01-21,51,"I used to go to the roof of Brandt, but they put a silent alarm up there a while ago.",Brantov,47.28111,38.21583,populated place,Donetsk,Kalmiuskyi Raion,Ukraine,VCU,City,,,,,,1
comment,2026-01-21,18,"anywhere other than out in the open in commons is my rec, 10/10 do not recommend.",Commons,46.59993,-112.04055,building(s),Montana,Lewis and Clark County,United States,VCU,Building,,,,,,2
comment,2026-01-23,1,Harris Hall late at night is completely dead.,Harris Hall,40.82083,-73.95028,building(s),New York,New York County,United States,VCU,Building,,,,,,4
comment,2026-01-28,1,"When it's warmer, surprisingly few people are ever on the library balcony or ALC courtyard.",Alicante,38.34517,-0.48149,seat of a second-order administrative division,Valencia,Provincia de Alicante,Spain,VCU,City,,,,,,1
post,2025-12-10,50,"a couple of big ones was this morning, i nearly slipped on the crosswalk crossing Franklin on the Belvidere intersection, a sole driver waiting at the red light gave me a thumbs up for the save which i appreciate .",Columbus,39.96118,-82.99879,seat of a first-order administrative division,Ohio,Franklin County,United States,VCU,City,,,,,,4
post,2025-12-10,50,"a couple of big ones was this morning, i nearly slipped on the crosswalk crossing Franklin on the Belvidere intersection, a sole driver waiting at the red light gave me a thumbs up for the save which i appreciate .",Belvidere,40.82982,-75.07767,seat of a second-order administrative division,New Jersey,Warren County,United States,VCU,City,,,,,,1
post,2025-12-10,50,another big slip 3 minutes after near the Berkshire where someone who witnessed me slip yell “it’s okay!” because i saved myself thankfully once again.,Berkshire,42.51258,-73.19288,populated place,Massachusetts,Berkshire County,United States,VCU,City,,,,,,1
post,2025-10-10,51,Would Monroe Park be a good place to set up a booth and try and sell some bugs?,Monroe Park,25.72955,-80.24533,park,Florida,Miami-Dade County,United States,VCU,Neighborhood,,,,,,29
post,2025-10-10,51,"Hello, 

I’m trying to sell some bug art at Monroe park on a Saturday.",Monroe County,25.55731,-80.91705,second-order administrative division,Florida,Monroe County,United States,VCU,State,,,,,,1
comment,2025-10-10,8,Monroe park is good but I feel like I see more people walking through the Compass.,Monroe Park,25.72955,-80.24533,park,Florida,Miami-Dade County,United States,VCU,Neighborhood,,,,,,29
comment,2025-10-10,8,Monroe park is good but I feel like I see more people walking through the Compass.,Compass,40.0226,-75.94245,populated place,Pennsylvania,Chester County,United States,VCU,City,,,,,,3
comment,2025-10-10,8,"People may get upset if you take cash though (specifically at the compass, don't think they can do anything about Monroe because it's not owned by VCU), there's a few rules around unregistered orgs/individuals (not businesses) exchanging cash on campus without a police officer present",Monroe County,37.56037,-80.55055,second-order administrative division,West Virginia,Monroe County,United States,VCU,State,,,,,,4
comment,2025-10-10,5,i don't go into richmond very often but i am interested in buying some bugs,Richmond,39.82894,-84.89024,seat of a second-order administrative division,Indiana,Wayne County,United States,VCU,City,,,,,,7
comment,2025-10-10,2,don’t live in rva anymore but i am very interested in purchasing from u!,Farafangana,-22.82223,47.82615,seat of a first-order administrative division,Atsimo-Atsinanana,Farafangana District,Madagascar,VCU,City,,,,,,21
comment,2025-10-11,1,The store Rest in Pieces located in Organ Hill might be interested,Organ Hill,-41.77,148.17999,hill,Tasmania,Break O'Day,Australia,VCU,Natural Feature,,,,,,1
comment,2025-10-11,1,Tomorrow around 9:30 I’m going to hang around Monroe park for probably two hours.,Monroe Park,25.72955,-80.24533,park,Florida,Miami-Dade County,United States,VCU,Neighborhood,,,,,,29
comment,2025-08-19,3,The West Main parking deck is only open to people with permits according to the sign out front.,West Main School,42.29337,-85.60945,school,Michigan,Kalamazoo County,United States,VCU,Building,,,,,,2
post,2025-02-19,51,Even other colleges and Richmond public schools are virtual tomorrow.,Richmond,37.55376,-77.46026,seat of a first-order administrative division,Virginia,City of Richmond,United States,VCU,City,,,,,,183
comment,2025-01-08,24,I’m back in RVA and I would HATE to go to class without the boil advisory lifted.,Farafangana,-22.82223,47.82615,seat of a first-order administrative division,Atsimo-Atsinanana,Farafangana District,Madagascar,VCU,City,,,,,,21
comment,2025-01-08,26," makes sense, I’m not against going to classes, just going back to Richmond until this is fixed",Richmond,37.55376,-77.46026,seat of a first-order administrative division,Virginia,City of Richmond,United States,VCU,City,,,,,,183
comment,2025-01-08,8,"The mayor of Richmond keeps making statements about how some of the pumps are working and the boil water advisory will be lifted soon, but then something else breaks, pushing back the timeline.",Richmond,37.55376,-77.46026,seat of a first-order administrative division,Virginia,City of Richmond,United States,VCU,City,,,,,,183
comment,2025-01-08,8,I understand this is not an isolated incident because Richmond’s equipment and infrastructure is very old.,Richmond,37.55376,-77.46026,seat of a first-order administrative division,Virginia,City of Richmond,United States,VCU,City,,,,,,183
comment,2025-01-08,7,It's just a very shitty situation all around for Richmond as a whole because even when we do get back water it won't be safe to use for at least a day or so to get the pressure and sentiment out of the pipes.,Richmond,37.55376,-77.46026,seat of a first-order administrative division,Virginia,City of Richmond,United States,VCU,City,,,,,,183
post,2024-11-02,49,"**After 5 days:** For follow-up medical services contact University Student Health Services

* Monroe Park Campus: 1300 W. Broad St., Suite 2200, (804) 828-8828
* MCV Campus: 1000 E. Marshall St., Room 305, (804) 828-9220

If you are unsure of which option to choose, go to VCU Medical Center.",Virginia Commonwealth University - Monroe Park Campus,37.55131,-77.45188,school,Virginia,City of Richmond,United States,VCU,Building,,,,,,2
post,2024-11-02,49,Forensic nursing services are also available at the Bon Secours facilities below.,Bon-Secours,46.36667,-65.03333,populated place,New Brunswick,Kent County,Canada,VCU,City,,,,,,1
post,2024-11-02,49,"Mary's Hospital|5801 Bremo Rd Richmond, VA|Non-emergency: (804) 281-8574 Emergency: (804) 281-8184|
|Richmond Community Hospital|1500 N. 28th Street Richmond, VA|Non-emergency: (804) 281-8574 Emergency: (804) 281-8184|
|Memorial Regional Medical Center |8260 Atlee Road Mechanicsville, VA |Non-emergency: (804) 281-8574 Emergency: (804) 281-8184|
|St.",Richmond,37.55376,-77.46026,seat of a first-order administrative division,Virginia,City of Richmond,United States,VCU,City,,,,,,183
post,2024-11-02,49,"Mary's Hospital|5801 Bremo Rd Richmond, VA|Non-emergency: (804) 281-8574 Emergency: (804) 281-8184|
|Richmond Community Hospital|1500 N. 28th Street Richmond, VA|Non-emergency: (804) 281-8574 Emergency: (804) 281-8184|
|Memorial Regional Medical Center |8260 Atlee Road Mechanicsville, VA |Non-emergency: (804) 281-8574 Emergency: (804) 281-8184|
|St.",Richmond,37.55376,-77.46026,seat of a first-order administrative division,Virginia,City of Richmond,United States,VCU,City,,,,,,183
post,2024-11-02,49,"Mary's Hospital|5801 Bremo Rd Richmond, VA|Non-emergency: (804) 281-8574 Emergency: (804) 281-8184|
|Richmond Community Hospital|1500 N. 28th Street Richmond, VA|Non-emergency: (804) 281-8574 Emergency: (804) 281-8184|
|Memorial Regional Medical Center |8260 Atlee Road Mechanicsville, VA |Non-emergency: (804) 281-8574 Emergency: (804) 281-8184|
|St.",Craney Island Estates,37.6482,-77.41054,populated place,Virginia,Hanover County,United States,VCU,City,,,,,,1
post,2024-11-02,49,"Mary's Hospital|5801 Bremo Rd Richmond, VA|Non-emergency: (804) 281-8574 Emergency: (804) 281-8184|
|Richmond Community Hospital|1500 N. 28th Street Richmond, VA|Non-emergency: (804) 281-8574 Emergency: (804) 281-8184|
|Memorial Regional Medical Center |8260 Atlee Road Mechanicsville, VA |Non-emergency: (804) 281-8574 Emergency: (804) 281-8184|
|St.",Virginia,37.54812,-77.44675,first-order administrative division,Virginia,,United States,VCU,State,,,,,,58
post,2024-11-02,49,"Francis Medical Center|13710 St. Francis Boulevard Midlothian, VA|Non-emergency: (804) 281-8574 Emergency: (804) 281-8184|
|Westchester Emergency Center|601 Watkins Centre Pkwy Midlothian, VA |Non-emergency: (804) 281-8574 Emergency: (804) 281-8184|
|Southside Regional Medical Center|200 Medical Park Blvd.",Midlothian,37.50598,-77.64916,populated place,Virginia,Chesterfield County,United States,VCU,City,,,,,,2
post,2024-11-02,49,"Francis Medical Center|13710 St. Francis Boulevard Midlothian, VA|Non-emergency: (804) 281-8574 Emergency: (804) 281-8184|
|Westchester Emergency Center|601 Watkins Centre Pkwy Midlothian, VA |Non-emergency: (804) 281-8574 Emergency: (804) 281-8184|
|Southside Regional Medical Center|200 Medical Park Blvd.",Midlothian,37.50598,-77.64916,populated place,Virginia,Chesterfield County,United States,VCU,City,,,,,,2
post,2024-11-02,49,"Francis Medical Center|13710 St. Francis Boulevard Midlothian, VA|Non-emergency: (804) 281-8574 Emergency: (804) 281-8184|
|Westchester Emergency Center|601 Watkins Centre Pkwy Midlothian, VA |Non-emergency: (804) 281-8574 Emergency: (804) 281-8184|
|Southside Regional Medical Center|200 Medical Park Blvd.",Virginia,37.54812,-77.44675,first-order administrative division,Virginia,,United States,VCU,State,,,,,,58
post,2024-11-02,49,"Petersburg, VA|Non-emergency: (804) 281-8574 Emergency: (804) 281-8184|
|Colonial Heights Emergency Care |60 East Roslyn Court Colonial Heights, VA|Non-emergency: (804) 281-8574 Emergency: (804) 281-8184|
|Short Pump Emergency Center|12320 West Broad StreetHenrico, Virginia|Non-emergency: (804) 281-8574 Emergency: (804) 281-8184|
|Consults are available at Rappahannock General Hospital|101 Harris RoadKilmarnock, VA|  Non-emergency: (804) 281-8574 Emergency: (804) 281-8184|",Petersburg,37.22793,-77.40193,seat of a second-order administrative division,Virginia,City of Petersburg,United States,VCU,City,,,,,,1
post,2024-11-02,49,"Petersburg, VA|Non-emergency: (804) 281-8574 Emergency: (804) 281-8184|
|Colonial Heights Emergency Care |60 East Roslyn Court Colonial Heights, VA|Non-emergency: (804) 281-8574 Emergency: (804) 281-8184|
|Short Pump Emergency Center|12320 West Broad StreetHenrico, Virginia|Non-emergency: (804) 281-8574 Emergency: (804) 281-8184|
|Consults are available at Rappahannock General Hospital|101 Harris RoadKilmarnock, VA|  Non-emergency: (804) 281-8574 Emergency: (804) 281-8184|",Colonial Heights,37.26804,-77.40726,seat of a second-order administrative division,Virginia,City of Colonial Heights,United States,VCU,City,,,,,,1
post,2024-10-24,48,I think it's really sucky that the ones filming right now with the damn mascot are taking up the only handicap accessible entrance in and out of Cabell.,Cabell County,38.4203,-82.24172,second-order administrative division,West Virginia,Cabell County,United States,VCU,State,,,,,,9
post,2024-04-11,51,"Yes there’s a lot of crime in Richmond, and yes you will get a lot of LiveSafe alerts, but I assure you as long as you have some decent enough common sense, it really isn’t that bad.",Richmond,37.55376,-77.46026,seat of a first-order administrative division,Virginia,City of Richmond,United States,VCU,City,,,,,,183
post,2020-06-02,50,Help out Richmond Protesters!,Richmond,37.55376,-77.46026,seat of a first-order administrative division,Virginia,City of Richmond,United States,VCU,City,,,,,,183
comment,2020-06-02,14,Yesterday Richmond community bail fund said they’ve received over $400k in donations and are suggesting to donate to Richmond Mutual Aid!,Richmond,37.55376,-77.46026,seat of a first-order administrative division,Virginia,City of Richmond,United States,VCU,City,,,,,,183
comment,2020-06-02,2,What does Richmond mutual aid do?,Richmond,37.55376,-77.46026,seat of a first-order administrative division,Virginia,City of Richmond,United States,VCU,City,,,,,,183
comment,2020-06-02,21,"vcu students live in richmond, if they have money they should help",Richmond,37.55376,-77.46026,seat of a first-order administrative division,Virginia,City of Richmond,United States,VCU,City,,,,,,183
post,2021-07-07,51,"My boyfriend and I were on a walk outside of the VCU library when he approached us to tell us about the racist roots of Cary St, VCU campus and Richmond in general (agree).",Best Western Plus Cary - Nc St,35.7623,-78.7476,hotel,North Carolina,Wake County,United States,VCU,Building,,,,,,4
post,2021-07-07,51,"My boyfriend and I were on a walk outside of the VCU library when he approached us to tell us about the racist roots of Cary St, VCU campus and Richmond in general (agree).",Richmond,37.55376,-77.46026,seat of a first-order administrative division,Virginia,City of Richmond,United States,VCU,City,,,,,,183
comment,2020-09-04,1,"It's like 1.6% or something, which is lower than Richmond as a whole.",Richmond,37.55376,-77.46026,seat of a first-order administrative division,Virginia,City of Richmond,United States,VCU,City,,,,,,183
comment,2020-09-04,3,% positive in richmond is calculated in terms of all tests done.,Richmond,39.82894,-84.89024,seat of a second-order administrative division,Indiana,Wayne County,United States,VCU,City,,,,,,7
comment,2020-09-04,3,Most people who get tested in RVA present with symptoms or fear of contact.,Farafangana,-22.82223,47.82615,seat of a first-order administrative division,Atsimo-Atsinanana,Farafangana District,Madagascar,VCU,City,,,,,,21
comment,2019-10-26,2,United States Military GI Bill.,United States,39.76,-98.5,independent political entity,,,United States,VCU,Country,,,,,,51
post,2026-03-19,48,"I grew up in Chapel Hill, a diehard UNC fan with lots of my relatives being alumni.",Chapel Hill,35.94288,-82.70875,populated place,North Carolina,Madison County,United States,VCU,City,,,,,,1
post,2025-04-01,50,Swedish Fish were taped onto Doors at GRC.,Great Chesterford Railway Station,52.05996,0.1931,railroad station,England,Essex,United Kingdom,VCU,Road,,,,,,13
comment,2013-08-01,1,They've gotten a lot worse since moving to Harris Hall.,Harris Hall,40.82083,-73.95028,building(s),New York,New York County,United States,VCU,Building,,,,,,4
comment,2013-08-02,1,the department was actually better when it was ONE SMALL ROOM in the little building behind Hibbs across from the playhouse theater.,Hibbs River,-42.57113,145.30372,stream,Tasmania,,Australia,VCU,Natural Feature,,,,,,7
comment,2012-11-28,3,That is how it is here at VT.,Vermont,44.00034,-72.74983,first-order administrative division,Vermont,,United States,VCU,State,,,,,,4
comment,2012-11-28,3,"If there was a suit brought against the school for discrimination, it would fail because of Virginia state law.",Virginia,37.54812,-77.44675,first-order administrative division,Virginia,,United States,VCU,State,,,,,,58
comment,2012-11-28,1,"Virginia state law doesn't protect discrimination for sexual orientation, this applies to VCU regardless of what their code of conduct policy is.",Virginia,37.54812,-77.44675,first-order administrative division,Virginia,,United States,VCU,State,,,,,,58
comment,2012-11-28,2,"I'm not from Virginia, so I'm not very clear on the laws.",Virginia,37.54812,-77.44675,first-order administrative division,Virginia,,United States,VCU,State,,,,,,58
comment,2025-09-01,3,maybe i won't go to vcu in the spring... yall see the odu kidnapper ?,VCU Massey Cancer Center,37.53926,-77.42868,hospital,Virginia,City of Richmond,United States,VCU,Building,,,,,,15
comment,2022-03-20,14,She normally would turn up within a couple blocks of Marshall park townhomes (728 w Marshall).,Marshall County,48.35813,-96.36847,second-order administrative division,Minnesota,Marshall County,United States,VCU,State,,,,,,2
comment,2022-03-20,14,She normally would turn up within a couple blocks of Marshall park townhomes (728 w Marshall).,Marshall County,48.35813,-96.36847,second-order administrative division,Minnesota,Marshall County,United States,VCU,State,,,,,,2
post,2022-02-18,48,Anyone feel like Campus is less safe than it used to be?,Campus,36.82629,10.14445,metro station,Tunis Governorate,,Tunisia,VCU,Road,,,,,,1
post,2022-02-18,48,"Both happened on grace street around chipotle and Panda Express, and one was in broad daylight too.",Grace Street House,38.44167,-78.87528,building(s),Virginia,City of Harrisonburg,United States,VCU,Building,,,,,,10
comment,2022-02-18,21,When I walk down Broad Street and I’m not wearing any spike jewelry I’ll have creeps harassing me and when I ignore them they’ll start yelling at me,Broad Street,51.12322,1.01526,populated place,England,Kent,United Kingdom,VCU,City,,,,,,1
comment,2022-02-18,12,Richmond as a whole has been on a decline the past year and a half.,Richmond,37.55376,-77.46026,seat of a first-order administrative division,Virginia,City of Richmond,United States,VCU,City,,,,,,183
comment,2022-02-19,-3,"Luckily I’m ugly so no one harasses me, but I mean  it’s Richmond so I expect it to not be the safest",Richmond,37.55376,-77.46026,seat of a first-order administrative division,Virginia,City of Richmond,United States,VCU,City,,,,,,183
comment,2022-02-18,-19,"Yes, Richmond is a dangerous place.",Richmond,51.46171,-0.30633,populated place,England,Greater London,United Kingdom,VCU,City,,,,,,10
comment,2022-02-18,-19,"they should be reported to the Virginia Commonwealth University  
Division of Student Affairs  
809 W. Broad Street, 2nd floor  
Richmond, VA 23284  
Phone: (804) 828-1963  
Fax: (804) 827-1579  
Email: honorsystem@vcu.edu or stuconduct@vcu.edu

On-Campus Emergency:  
(804) 828-1234  
Off-Campus Emergency:  
911  
Non-Emergency:  
(804) 828-1196  
RamSafe Escort Service:  
(804) 828-SAFE (7233)  
24 Hour Student Counseling Services  
(804) 828-6200",Richmond,37.55376,-77.46026,seat of a first-order administrative division,Virginia,City of Richmond,United States,VCU,City,,,,,,183
comment,2022-02-18,-19,"they should be reported to the Virginia Commonwealth University  
Division of Student Affairs  
809 W. Broad Street, 2nd floor  
Richmond, VA 23284  
Phone: (804) 828-1963  
Fax: (804) 827-1579  
Email: honorsystem@vcu.edu or stuconduct@vcu.edu

On-Campus Emergency:  
(804) 828-1234  
Off-Campus Emergency:  
911  
Non-Emergency:  
(804) 828-1196  
RamSafe Escort Service:  
(804) 828-SAFE (7233)  
24 Hour Student Counseling Services  
(804) 828-6200",Virginia,37.54812,-77.44675,first-order administrative division,Virginia,,United States,VCU,State,,,,,,58
comment,2022-02-18,1,"I was in Blacksburg like two weeks ago and they had another active shooter at VT, so it's happening everywhere",Blacksburg,37.81874,-79.3192,populated place,Virginia,Rockbridge County,United States,VCU,City,,,,,,1
comment,2022-02-19,-4,In May I will return to the US and sell my house.,United States,39.76,-98.5,independent political entity,,,United States,VCU,Country,,,,,,51
comment,2022-02-19,18,They had a shooting at a bar in Blacksburg.,Blacksburg,35.12124,-81.51592,populated place,South Carolina,Cherokee County,United States,VCU,City,,,,,,2
comment,2022-02-19,18,"That is near VT. That's different from a active shooter at VT. 


That would be like saying  schools have active shooter when ever there is a shooting taking place in the nearby city.",Vermont,44.00034,-72.74983,first-order administrative division,Vermont,,United States,VCU,State,,,,,,4
comment,2022-02-19,18,"That is near VT. That's different from a active shooter at VT. 


That would be like saying  schools have active shooter when ever there is a shooting taking place in the nearby city.",Vermont,44.00034,-72.74983,first-order administrative division,Vermont,,United States,VCU,State,,,,,,4
comment,2022-02-19,2,"I hear you but the part of BBurg where the bar was was basically like 75 steps off campus, and the suspects stole a car from The Edge, which is right across the street from campus and made entirely of VT students",The Edge,33.01667,-118.61667,bank,California,,United States,VCU,Natural Feature,,,,,,1
comment,2022-02-18,7,Are you talking about the VCU police or Richmond?,Richmond,37.55376,-77.46026,seat of a first-order administrative division,Virginia,City of Richmond,United States,VCU,City,,,,,,183
comment,2022-02-19,1,Yet we don't spin it that way unless because Richmond is a very blue city.,Richmond,37.55376,-77.46026,seat of a first-order administrative division,Virginia,City of Richmond,United States,VCU,City,,,,,,183
