type,date,score,sentences,place,latitude,longitude,feature_type,admin1_name,admin2_name,country_name,school,place_type,action,corrected_name,corrected_latlon,corrected_place_type,reviewer,place_count
comment,2020-05-26,12,It’s not even a VCU problem it’s just a school problem in the US.,United States,39.76,-98.5,independent political entity,,,United States,VCU,Country,,,,,,51
post,2026-03-20,86,"VCU Stuns North Carolina in March Madness 2026: Down 19, Then Gone in One of the Greatest Upsets of the Tournament",North Carolina,35.50069,-80.00032,first-order administrative division,North Carolina,,United States,VCU,State,,,,,,4
comment,2022-01-28,3,"Become an alumni patron, if you’re staying in Richmond.",Richmond,37.55376,-77.46026,seat of a first-order administrative division,Virginia,City of Richmond,United States,VCU,City,,,,,,183
comment,2020-08-22,3,"VCU is not isolated, so spread at VCU affects the entire Richmond community.",Richmond,37.55376,-77.46026,seat of a first-order administrative division,Virginia,City of Richmond,United States,VCU,City,,,,,,183
comment,2024-04-30,16,Imagine tuning into what's been going on in Palestine every morning for years.,Palestine,31.92157,35.20329,semi-independent political entity,,,Palestinian Territory,VCU,Country,,,,,,25
comment,2022-10-18,-13,There are so many homeless people in Richmond.,Richmond,37.55376,-77.46026,seat of a first-order administrative division,Virginia,City of Richmond,United States,VCU,City,,,,,,183
comment,2020-09-16,1,Empty alcohol containers might as well be part of Richmond’s ecosystem,Richmond,37.55376,-77.46026,seat of a first-order administrative division,Virginia,City of Richmond,United States,VCU,City,,,,,,183
post,2020-01-17,85,"Just yesterday I saw a student almost get creamed at the light in front of the Temple building, because someone someone stopped at the green light and waved them across, and a car in the other lane (rightfully) drove through and almost hit them.",Paris 03 Temple,48.8637,2.3615,populated place,Île-de-France,Paris,France,VCU,City,,,,,,3
comment,2020-01-24,2,"I’ve been crossing main st in front of Snead every god damn day of my life for the past 2 years and I shit you not, every other day some wayward samaritan stops in the middle lane during rush hour to let a flock of students by.",Resortquest At Main St Station,39.4771,-106.045,hotel,Colorado,Summit County,United States,VCU,Building,,,,,,1
comment,2020-01-17,1,"The problem is that by the ancient laws of Virginia when you hit a pedestrian, unless there's a suicide note involved you are going down.",Virginia,37.54812,-77.44675,first-order administrative division,Virginia,,United States,VCU,State,,,,,,58
comment,2020-01-18,1,"The car that hit the pedestrian would have man slaughter chargers at least but, Richmond has some stupid fucking drivers none the less.",Richmond,37.55376,-77.46026,seat of a first-order administrative division,Virginia,City of Richmond,United States,VCU,City,,,,,,183
comment,2023-02-23,2,"I live in Richmond and have an anecdote to share regarding frats, and propose a potential idea for a solution.",Richmond,37.55376,-77.46026,seat of a first-order administrative division,Virginia,City of Richmond,United States,VCU,City,,,,,,183
comment,2020-01-16,9,"When you spot an open space on Cary St on the left side of the road with other cars coming up behind you, you learn how to parallel park mirrored really quick.",Best Western Plus Cary - Nc St,35.7623,-78.7476,hotel,North Carolina,Wake County,United States,VCU,Building,,,,,,4
comment,2020-01-16,4,"Too many cars in RVA pressure you, honk, zoom around dangerously, etc.",Farafangana,-22.82223,47.82615,seat of a first-order administrative division,Atsimo-Atsinanana,Farafangana District,Madagascar,VCU,City,,,,,,21
comment,2025-12-08,1,"This is purely a guess, but as someone who used to live on Franklin Street my guess is they keep it like that because the trees that are planted in the sidewalks.",Franklin Street,14.62864,121.11388,street,Calabarzon,Province of Rizal,Philippines,VCU,Road,,,,,,1
comment,2025-12-07,33,Cathedral Place is privately owned and the sidewalks are owned by the people who own the houses that front on them.,Cathedral Place,43.04083,-87.90444,building(s),Wisconsin,Milwaukee County,United States,VCU,Building,,,,,,1
post,2020-09-03,81,"There’s a Sonic open on campus :) Idk if there’s any sonic lovers here but there was a new one in construction and it just opened up today (right next to mojos, behind GRC)

If you’re gonna go, socially distance, stay safe, and enjoy those great burgers and milkshakes :))",Provincia Moxos,-15.50025,-65.67616,second-order administrative division,Beni Department,Provincia Moxos,Bolivia,VCU,State,,,,,,1
post,2020-09-03,81,"There’s a Sonic open on campus :) Idk if there’s any sonic lovers here but there was a new one in construction and it just opened up today (right next to mojos, behind GRC)

If you’re gonna go, socially distance, stay safe, and enjoy those great burgers and milkshakes :))",Great Chesterford Railway Station,52.05996,0.1931,railroad station,England,Essex,United Kingdom,VCU,Road,,,,,,13
comment,2020-09-03,3,It’s walkable (I live right next to GRC) and there’s no drive in so you don’t really need a car.,Great Chesterford Railway Station,52.05996,0.1931,railroad station,England,Essex,United Kingdom,VCU,Road,,,,,,13
comment,2021-03-24,-6,Florida is the move,Florida,28.75054,-82.5001,first-order administrative division,Florida,,United States,VCU,State,,,,,,4
comment,2025-09-17,2,"VCU started increasing its police presence especially when trump increased police presence in D.C. As a student I’ve lived on campus for years, VCU has always aligned itself with Trumps views.",District of Columbia,38.91706,-77.00025,first-order administrative division,District of Columbia,,United States,VCU,State,,,,,,8
comment,2025-09-18,10,it was in mississippi,Mississippi,32.75041,-89.75036,first-order administrative division,Mississippi,,United States,VCU,State,,,,,,1
comment,2025-09-18,4,Found some interesting facts: 1) civil wars in America are not officially declared.,United States,39.76,-98.5,independent political entity,,,United States,VCU,Country,,,,,,51
comment,2022-04-19,8,"They could use one of the commons ballrooms, the ones right at the top of the stairs in the foodcourt?",Commons,53.54239,-6.80159,populated place,Leinster,Meath,Ireland,VCU,City,,,,,,9
comment,2020-08-17,3,Are you talking about those spring breakers in Miami vid or is there another vid?,Miami,25.77427,-80.19366,seat of a second-order administrative division,Florida,Miami-Dade County,United States,VCU,City,,,,,,1
post,2013-04-23,75,"You stay classy, Temple building",Paris 03 Temple,48.8637,2.3615,populated place,Île-de-France,Paris,France,VCU,City,,,,,,3
comment,2023-12-07,27,I too remember the 'glory days' of nocturnal paper-writing fueled by the ever-burning lights of Cabell.,Cabell County,38.4203,-82.24172,second-order administrative division,West Virginia,Cabell County,United States,VCU,State,,,,,,9
comment,2022-10-08,11,"https://law.lis.virginia.gov/vacode/title8.01/chapter3/section8.01-226.12/  
  
""Notice"" means notice given in writing by either regular mail or hand delivery, with sender retaining sufficient proof of having given such notice, which may be either a United States postal certificate of mailing or a certificate of service confirming such mailing prepared by the sender.",United States,39.76,-98.5,independent political entity,,,United States,VCU,Country,,,,,,51
comment,2022-10-09,3,i lived in GRC (recently moved out) and i’d start violently coughing everytime i stepped in there,Great Chesterford Railway Station,52.05996,0.1931,railroad station,England,Essex,United Kingdom,VCU,Road,,,,,,13
comment,2022-10-09,3,My dad drove to Richmond and brought a ladder to look for me tho cause I had found mold on ceiling in my bathroom,Richmond,37.55376,-77.46026,seat of a first-order administrative division,Virginia,City of Richmond,United States,VCU,City,,,,,,183
comment,2025-02-02,2,Ahhh America,United States,39.76,-98.5,independent political entity,,,United States,VCU,Country,,,,,,51
comment,2025-02-02,18,I worked at a public university in CA that pays adjuncts 3x what VCU does and VCU has the larger endowment.,California,37.25022,-119.75126,first-order administrative division,California,,United States,VCU,State,,,,,,1
comment,2025-02-02,2,"Some people want to live in Richmond, and teaching is what they want to do, and there aren't many other alternatives.",Richmond,37.55376,-77.46026,seat of a first-order administrative division,Virginia,City of Richmond,United States,VCU,City,,,,,,183
comment,2024-03-31,2,"He is, after all, a duly elected (lame duck) Governor, and you attend one of the largest Public Universities in the Commonwealth.",Commonwealth,14.6969,121.08006,populated place,National Capital Region,Eastern Manila District,Philippines,VCU,City,,,,,,3
comment,2021-09-15,5,"It’s on Floyd Avenue, right next to Cabell Library.",Floyd Avenue Church,35.22314,-90.02287,church,Tennessee,Shelby County,United States,VCU,Building,,,,,,1
comment,2021-09-15,5,"It’s on Floyd Avenue, right next to Cabell Library.",James Cabell Library,37.54792,-77.45387,library,Virginia,City of Richmond,United States,VCU,Building,,,,,,2
comment,2020-09-05,-1,Also didn't realize you literally came back to RVa to live in a bubble.,Farafangana,-22.82223,47.82615,seat of a first-order administrative division,Atsimo-Atsinanana,Farafangana District,Madagascar,VCU,City,,,,,,21
comment,2023-10-19,16,Alternatives in Carytown sells similar products and \*actually\* give back to indigenous communities that help make their products.,Careytown,39.31006,-83.62909,populated place,Ohio,Highland County,United States,VCU,City,,,,,,7
comment,2023-10-19,16,Sometimes they have a booth on the corner of Brandt/Rhoads and Monroe Park.,Monroe Park,41.5217,-90.60014,park,Iowa,Scott County,United States,VCU,Neighborhood,,,,,,5
comment,2023-10-19,6,She runs a ecological/medical mission trip to Guatemala.,Guatemala City,14.64072,-90.51327,capital of a political entity,Guatemala,Municipio de Guatemala,Guatemala,VCU,City,,,,,,1
comment,2019-12-26,10,From Charlottesville.,Charlottesville,38.02931,-78.47668,seat of a second-order administrative division,Virginia,City of Charlottesville,United States,VCU,City,,,,,,6
comment,2019-12-26,5,"Also from Charlottesville, disappointed but not surprised",Charlottesville,38.02931,-78.47668,seat of a second-order administrative division,Virginia,City of Charlottesville,United States,VCU,City,,,,,,6
comment,2019-12-26,5,"Same, UVA students IK are going on a very lavish Europe trip this summer for about a month and a half.",Europe,48.69096,9.14062,continent,,,,VCU,Country,,,,,,2
comment,2026-04-27,10,"Hello yall, CT news editor Heciel here.",Connecticut,41.66704,-72.66648,first-order administrative division,Connecticut,,United States,VCU,State,,,,,,1
comment,2026-04-30,1,Collective bargaining by graduate students is not legal in Virginia.,Virginia,37.54812,-77.44675,first-order administrative division,Virginia,,United States,VCU,State,,,,,,58
comment,2025-08-04,29,"I have never lived there myself, but I had a friend who basically moved in with me to avoid their apartment at Coliseum lofts.",Coliseum,40.82139,-96.70252,building(s),Nebraska,Lancaster County,United States,VCU,Building,,,,,,2
comment,2025-08-04,12,"Honestly, there were bugs but I honestly feel like you’re gonna get them in any older Richmond building.",Richmond,37.55376,-77.46026,seat of a first-order administrative division,Virginia,City of Richmond,United States,VCU,City,,,,,,183
comment,2025-08-05,4,"For instance, the iron house apartments next to coliseum are even worse from what I’ve heard and don’t have parking.",Coliseum,40.82139,-96.70252,building(s),Nebraska,Lancaster County,United States,VCU,Building,,,,,,2
comment,2025-08-05,2,"From what I heard, you get roaches anywhere you go in Richmond, and living on Broad is an amazing experience for both the campus and easy access to nightlife and great food.",Richmond,37.55376,-77.46026,seat of a first-order administrative division,Virginia,City of Richmond,United States,VCU,City,,,,,,183
comment,2025-08-05,2,"From what I heard, you get roaches anywhere you go in Richmond, and living on Broad is an amazing experience for both the campus and easy access to nightlife and great food.",Broad,33.94706,-82.70653,populated place,Georgia,Wilkes County,United States,VCU,City,,,,,,6
comment,2025-08-07,1,Check out the Biggs building just across broad.,Broad,33.94706,-82.70653,populated place,Georgia,Wilkes County,United States,VCU,City,,,,,,6
comment,2025-08-04,-5,The current in Manchester has been great,Manchester,53.48095,-2.23743,seat of a second-order administrative division,England,Manchester,United Kingdom,VCU,City,,,,,,1
comment,2025-08-04,40,"Also, living directly on Broad Street was NOT fun for them",Broad Street,51.51605,-0.08601,section of populated place,England,Greater London,United Kingdom,VCU,Neighborhood,,,,,,3
post,2025-07-31,73,Triples in GRC I’m in GRC over the summer and figured someone might benefit from seeing the converted lounges as the triples they’re being used as.,Grand Cess,4.5689,-8.21999,populated place,Grand Kru County,,Liberia,VCU,City,,,,,,18
post,2025-07-31,73,Triples in GRC I’m in GRC over the summer and figured someone might benefit from seeing the converted lounges as the triples they’re being used as.,Grand Cess,4.5689,-8.21999,populated place,Grand Kru County,,Liberia,VCU,City,,,,,,18
comment,2025-08-01,6,I lived in this exact same room set up in GRC but it was a Quad room,Grand Cess,4.5689,-8.21999,populated place,Grand Kru County,,Liberia,VCU,City,,,,,,18
comment,2025-08-01,6,I lived in this exact same room set up in GRC but it was a Quad room,Quad,40.77078,-111.75827,populated place,Utah,Salt Lake County,United States,VCU,City,,,,,,1
comment,2025-08-20,1,I was in Johnson Hall when it closed down in 2021 (I got a converted study room in GRC) Are they still putting freshmen up in hotels??,Johnson Hall,41.37204,-72.10035,building(s),Connecticut,Southeastern Connecticut Planning Region,United States,VCU,Building,,,,,,2
comment,2025-08-20,1,I was in Johnson Hall when it closed down in 2021 (I got a converted study room in GRC) Are they still putting freshmen up in hotels??,Great Chesterford Railway Station,52.05996,0.1931,railroad station,England,Essex,United Kingdom,VCU,Road,,,,,,13
comment,2025-08-04,1,"The housing issue in downtown Richmond is insane, so if every freshman VCU accepted tried finding a place off campus, every single crevice and alleyway would be taken.",Richmond,37.55376,-77.46026,seat of a first-order administrative division,Virginia,City of Richmond,United States,VCU,City,,,,,,183
comment,2025-08-01,0,In fall 2020 they actually had the lounges closed off due to covid and you couldn’t use most of the amenities in GRC,Grand Cess,4.5689,-8.21999,populated place,Grand Kru County,,Liberia,VCU,City,,,,,,18
post,2024-09-12,73,Where on or near campus has these  I just need some of this in my life rn and I’m not tryna spend an hour round trip to go to target.,Target,46.28938,3.06139,populated place,Rhône-Alpes,Allier,France,VCU,City,,,,,,1
post,2024-09-12,73,Is there anything walking distance from Monroe to get these.,Monroe County,35.44265,-84.25279,second-order administrative division,Tennessee,Monroe County,United States,VCU,State,,,,,,4
comment,2024-09-12,49,maybe you are nearby a bus stop that can get you to kroger?,Kröger,51.99441,8.28833,farm,North Rhine-Westphalia,Regierungsbezirk Detmold,Germany,VCU,Building,,,,,,1
comment,2024-09-12,5,"lombardy kroger, it’s like 10/15 minute walk from monroe depending on how fast you walk.",Monroe County,39.72735,-81.08292,second-order administrative division,Ohio,Monroe County,United States,VCU,State,,,,,,1
comment,2024-09-12,2,Carytown and Lombardy Kroger!,Careytown,39.31006,-83.62909,populated place,Ohio,Highland County,United States,VCU,City,,,,,,7
comment,2024-09-16,2,Maybe the ram city market; it is next to panda,Pandi,14.865,120.95722,seat of a third-order administrative division,Central Luzon,Province of Bulacan,Philippines,VCU,City,,,,,,1
comment,2024-09-13,1,"Aldis and lidl, both can be reached by the bus on broad st",Aldis Park,42.09503,-88.27536,park,Illinois,Kane County,United States,VCU,Neighborhood,,,,,,1
comment,2024-09-13,1,"Aldis and lidl, both can be reached by the bus on broad st",Lidl,38.36887,-77.52622,store,Virginia,Stafford County,United States,VCU,Building,,,,,,1
comment,2024-09-13,2,The carytown one you could take bus 5 (cary/main/whitcomb) going westbound,Careytown,39.31006,-83.62909,populated place,Ohio,Highland County,United States,VCU,City,,,,,,7
comment,2026-02-17,10,Just another day in Richmond,Richmond,37.55376,-77.46026,seat of a first-order administrative division,Virginia,City of Richmond,United States,VCU,City,,,,,,183
comment,2022-06-12,1,Guess we will be seeing milk drinking competitions in Monroe Park this semester.,Monroe Park,41.5217,-90.60014,park,Iowa,Scott County,United States,VCU,Neighborhood,,,,,,5
comment,2022-05-11,28,Gross and that stuff will end up in the James.,James,32.96653,-83.47378,populated place,Georgia,Jones County,United States,VCU,City,,,,,,3
comment,2022-05-11,-6,"Considering Richmond and Virginia as a whole has been a hotbed for protests and divisiveness, I wouldn’t call my analysis a stretch at all… just talk to anyone around campus like foreal.",Richmond,37.55376,-77.46026,seat of a first-order administrative division,Virginia,City of Richmond,United States,VCU,City,,,,,,183
comment,2022-05-11,-6,"Considering Richmond and Virginia as a whole has been a hotbed for protests and divisiveness, I wouldn’t call my analysis a stretch at all… just talk to anyone around campus like foreal.",Virginia,37.54812,-77.44675,first-order administrative division,Virginia,,United States,VCU,State,,,,,,58
post,2021-09-07,72,I will be representing VCU tonight at 9 est in the Collegiate iRacing League Oval Series Season 3 Round 1 at Daytona,Daytona Beach,29.21081,-81.02283,populated place,Florida,Volusia County,United States,VCU,City,,,,,,1
comment,2022-01-14,1,Just a PSA to women to RVA beware of a man who goes by Jvon.,Farafangana,-22.82223,47.82615,seat of a first-order administrative division,Atsimo-Atsinanana,Farafangana District,Madagascar,VCU,City,,,,,,21
comment,2022-01-14,1,He frequents Therapy which used to be ChaChas in Shockoe.,Chachas,-15.50137,-72.27014,seat of a third-order administrative division,Arequipa,Provincia de Castilla,Peru,VCU,City,,,,,,1
comment,2022-01-14,1,He frequents Therapy which used to be ChaChas in Shockoe.,Shockoe,36.80875,-79.26391,populated place,Virginia,Pittsylvania County,United States,VCU,City,,,,,,1
post,2019-11-20,74,Please return my shoe Hey I was using the bathroom in the commons earlier today and I usually take my shoes off to pee and some thief snatched one of my shoes.,Commons,53.54239,-6.80159,populated place,Leinster,Meath,Ireland,VCU,City,,,,,,9
comment,2019-11-20,3,"https://imgur.com/gallery/E0UfmXB

The sign outside of the commons my dude.",Commons,53.54239,-6.80159,populated place,Leinster,Meath,Ireland,VCU,City,,,,,,9
comment,2019-11-20,0,I’ll return it to the info desk at commons if I find it.,Commons,46.59993,-112.04055,building(s),Montana,Lewis and Clark County,United States,VCU,Building,,,,,,2
comment,2025-09-15,3,Richmond not having a major water crisis for six months challenge (impossible),Grand River,41.73615,-81.28121,populated place,Ohio,Lake County,United States,VCU,City,,,,,,2
comment,2025-09-12,1,What’s Mcv gym,McArthur River Mine Airport,-16.44257,136.07602,airport,Northern Territory,Roper Gulf,Australia,VCU,Building,,,,,,1
comment,2025-02-06,30,"they were asking for like 250 bucks initially, like LMAO you're on a college campus in Richmond who has that",Richmond,37.55376,-77.46026,seat of a first-order administrative division,Virginia,City of Richmond,United States,VCU,City,,,,,,183
comment,2025-02-07,5,Girl walked up to me asked “What’s the only state that ends in the letter K?” I dropped “New York” immediately and brushed right past her.,New York,43.00035,-75.4999,first-order administrative division,New York,,United States,VCU,State,,,,,,1
comment,2025-02-06,1,I had this happen to me at the petco in chester last year.,Chester,53.1905,-2.89189,seat of a second-order administrative division,England,Cheshire West and Chester,United Kingdom,VCU,City,,,,,,1
comment,2023-04-17,2,Richmond is such a fun city and a great art city as well!,Richmond,51.46171,-0.30633,populated place,England,Greater London,United Kingdom,VCU,City,,,,,,10
comment,2023-05-15,1,The other is a very successful voice over talent living her best life in LA.,Los Angeles,34.05223,-118.24368,seat of a second-order administrative division,California,Los Angeles County,United States,VCU,City,,,,,,3
comment,2022-11-11,18,"It's all just alarming to think about, especially since Cabell is a comfortable hang out spot for me",Cabell County,38.4203,-82.24172,second-order administrative division,West Virginia,Cabell County,United States,VCU,State,,,,,,9
comment,2022-11-11,13,"my sister was saving for a vacation a couple years ago and was taking cash to the bank after an event in harris hall, but someone stole all of it and vcupd couldnt find the culprit nor did they call/message back to update even though the cameras are supposedly all “functional” for that one way entrance and we knew the exact 15-minute window of time when someone could have entered and stolen the cash.",Harris Hall,40.82083,-73.95028,building(s),New York,New York County,United States,VCU,Building,,,,,,4
comment,2021-06-08,3,They have always required more immunizations than Monroe park campus students.,Monroe Park,41.5217,-90.60014,park,Iowa,Scott County,United States,VCU,Neighborhood,,,,,,5
comment,2020-08-30,49,America has fuckin botched this,United States,39.76,-98.5,independent political entity,,,United States,VCU,Country,,,,,,51
comment,2024-04-30,18,I heard that police used tear gas on the crowd at Cabell but that's just from word of mouth.,Cabell County,38.4203,-82.24172,second-order administrative division,West Virginia,Cabell County,United States,VCU,State,,,,,,9
comment,2024-04-30,2,I’m a VCU alum and am no longer in Richmond.,Richmond,37.55376,-77.46026,seat of a first-order administrative division,Virginia,City of Richmond,United States,VCU,City,,,,,,183
comment,2024-04-30,2,"I was in Richmond for about a decade, left in 2014.",Richmond,37.55376,-77.46026,seat of a first-order administrative division,Virginia,City of Richmond,United States,VCU,City,,,,,,183
comment,2020-06-11,2,:o I'm kinda glad I have an excuse to be in Richmond.,Richmond,37.55376,-77.46026,seat of a first-order administrative division,Virginia,City of Richmond,United States,VCU,City,,,,,,183
comment,2020-06-11,1,">  
>First, in order to comply with safety measures, **all courses with an enrollment of 50 or more students on the Monroe Park and MCV Campuses will be taught in a remote/online format.",Monroe Park,25.72955,-80.24533,park,Florida,Miami-Dade County,United States,VCU,Neighborhood,,,,,,29
comment,2025-11-23,8,But what are they gonna do with Johnson hall?,Johnson Hall,41.37204,-72.10035,building(s),Connecticut,Southeastern Connecticut Planning Region,United States,VCU,Building,,,,,,2
comment,2025-11-23,6,It doesn’t sound like student housing is on the table for it any more though (since new west grace dorm is being built).,West Grace Cemetery,43.78523,-91.84487,cemetery,Minnesota,Fillmore County,United States,VCU,Building,,,,,,3
comment,2025-04-08,19,Vcu is a lovely place full of all different kinds of people!,VCU Massey Cancer Center,37.53926,-77.42868,hospital,Virginia,City of Richmond,United States,VCU,Building,,,,,,15
comment,2025-04-08,7,"Being embedded in Richmond, VCU really has an amazing arts community.",Richmond,37.55376,-77.46026,seat of a first-order administrative division,Virginia,City of Richmond,United States,VCU,City,,,,,,183
comment,2025-04-09,2,I absolutely hated my first tour at vcu it was 105 degrees and out of 15 colleges vcu was the last after a long drive from Florida.,Florida,28.75054,-82.5001,first-order administrative division,Florida,,United States,VCU,State,,,,,,4
comment,2024-08-16,14,Virginia is not a show your ID state.,Virginia,37.54812,-77.44675,first-order administrative division,Virginia,,United States,VCU,State,,,,,,58
comment,2024-08-16,3,"While the state of Virginia does not have a law pertaining to the requirement of ID’ing oneself when asked by law enforcement, case law has upheld local ordinances requiring that within different localities in the state",Virginia,37.54812,-77.44675,first-order administrative division,Virginia,,United States,VCU,State,,,,,,58
comment,2024-08-16,0,"It shall be unlawful for any person over 16 years of age to, with the intent to conceal his identity, wear any mask, hood or other device whereby a substantial portion of the face is hidden or covered so as to conceal the identity of the wearer, to be or appear in any public place, or upon any private property in this Commonwealth without first having obtained from the owner or tenant thereof consent to do so in writing.",Commonwealth,14.6969,121.08006,populated place,National Capital Region,Eastern Manila District,Philippines,VCU,City,,,,,,3
