type,date,score,sentences,place,latitude,longitude,feature_type,admin1_name,admin2_name,country_name,school,place_type,action,corrected_name,corrected_latlon,corrected_place_type,reviewer,place_count
post,2025-01-31,1062,"VCU Health suspends gender-affirming care for those 18 and younger RICHMOND, Va. (WRIC) — Virginia Commonwealth University (VCU) Health and the Children’s Hospital of Richmond at VCU have suspended gender-affirming care for patients under 19 years old in the wake of President Donald Trump’s executive order that cuts federal funding for such care.",Richmond,37.55376,-77.46026,seat of a first-order administrative division,Virginia,City of Richmond,United States,VCU,City,,,,,,183
post,2025-01-31,1062,"VCU Health suspends gender-affirming care for those 18 and younger RICHMOND, Va. (WRIC) — Virginia Commonwealth University (VCU) Health and the Children’s Hospital of Richmond at VCU have suspended gender-affirming care for patients under 19 years old in the wake of President Donald Trump’s executive order that cuts federal funding for such care.",Estación Va. Calzada,-34.79668,-58.35914,railroad station,Buenos Aires,Partido de Almirante Brown,Argentina,VCU,Road,,,,,,2
post,2025-01-31,1062,"Appointments will be maintained to discuss specific care options for patients in compliance with the most recent guidance.”

This move would make the Richmond hospital one of several that’s put such care on hold as healthcare facilities consider the impacts of Trump’s order, according to the Associated Press.""",Richmond,37.55376,-77.46026,seat of a first-order administrative division,Virginia,City of Richmond,United States,VCU,City,,,,,,183
comment,2025-02-04,2,Everyone must first remember Virginia is a Red State controlled by a Republican Governor who is doing everything on earth to buddy up to Trump in order to worm his way into his good graces after being removed from office in 2026.,Virginia,37.54812,-77.44675,first-order administrative division,Virginia,,United States,VCU,State,,,,,,58
comment,2025-02-04,2,The is the very definition of the a Capitalist POP economy that currently dominates America that both the Republican and the Democratic parties in America support 100%; an economy dominated by Big Pharma and the ~~Wealthcare~~ sorry I meant to say the Healthcare and Insurance industries in America controlling our economy.,United States,39.76,-98.5,independent political entity,,,United States,VCU,Country,,,,,,51
comment,2025-02-04,2,The is the very definition of the a Capitalist POP economy that currently dominates America that both the Republican and the Democratic parties in America support 100%; an economy dominated by Big Pharma and the ~~Wealthcare~~ sorry I meant to say the Healthcare and Insurance industries in America controlling our economy.,United States,39.76,-98.5,independent political entity,,,United States,VCU,Country,,,,,,51
comment,2025-02-04,2,The is the very definition of the a Capitalist POP economy that currently dominates America that both the Republican and the Democratic parties in America support 100%; an economy dominated by Big Pharma and the ~~Wealthcare~~ sorry I meant to say the Healthcare and Insurance industries in America controlling our economy.,United States,39.76,-98.5,independent political entity,,,United States,VCU,Country,,,,,,51
comment,2025-02-04,2,"Don't let anyone fool you, this is all about big money influencing, ~~Wealthcare~~ damn I did it again, Healthcare decisions in America.",United States,39.76,-98.5,independent political entity,,,United States,VCU,Country,,,,,,51
comment,2025-02-04,1,2 weeks in and America is already healing,United States,39.76,-98.5,independent political entity,,,United States,VCU,Country,,,,,,51
post,2025-07-23,846,Palestinian American Student & Dad: 200 Relatives Killed in Gaza; VCU Withholds Diploma for Protest >Virginia Commonwealth University is withholding the diploma of a Palestinian American student because of her campus activism.,Gaza,31.50161,34.46672,seat of a first-order administrative division,Gaza Strip,Gaza,Palestinian Territory,VCU,City,,,,,,16
post,2025-07-23,846,"In a hearing Tuesday, officials examined the case of VCU student Sereen Haddad, who was told she would not receive her diploma at her graduation this year because of her participation in a peaceful memorial commemorating violent police arrests at a student encampment for Palestine in 2024.",Palestine,31.92157,35.20329,semi-independent political entity,,,Palestinian Territory,VCU,Country,,,,,,25
post,2025-07-23,846,"Sereen Haddad is the daughter of Tariq Haddad, a cardiologist who grew up in Gaza.",Gaza,31.50161,34.46672,seat of a first-order administrative division,Gaza Strip,Gaza,Palestinian Territory,VCU,City,,,,,,16
post,2025-07-23,846,Dr. Haddad made headlines last year for rejecting an invitation to meet with then-Secretary of State Antony Blinken because of the Biden administration’s support for Israel’s actions in Gaza.,State of Israel,31.5,34.75,independent political entity,,,Israel,VCU,Country,,,,,,30
post,2025-07-23,846,Dr. Haddad made headlines last year for rejecting an invitation to meet with then-Secretary of State Antony Blinken because of the Biden administration’s support for Israel’s actions in Gaza.,Gaza,31.50161,34.46672,seat of a first-order administrative division,Gaza Strip,Gaza,Palestinian Territory,VCU,City,,,,,,16
comment,2025-07-24,8,Fuck Glenn Youngkin and his capitulation to Israel.,State of Israel,31.5,34.75,independent political entity,,,Israel,VCU,Country,,,,,,30
comment,2025-07-24,8,Really hope the commonwealth wakes up to Israel using Epstein to control the GOPedo.,State of Israel,31.5,34.75,independent political entity,,,Israel,VCU,Country,,,,,,30
comment,2025-07-24,3,Don't forget that Israel has free healthcare including legal free abortions.,State of Israel,31.5,34.75,independent political entity,,,Israel,VCU,Country,,,,,,30
comment,2025-07-24,3,It seems that VCU issued a ban on sidewalk chalking after a student group used the tactic to raise awareness about VCU’s involvement supporting Israel during the apartheid/genocide.,State of Israel,31.5,34.75,independent political entity,,,Israel,VCU,Country,,,,,,30
comment,2025-07-25,1,"The Middle East is the start of western civilization, they are ahead of you and don’t care what tribal faith you are.",Al Bank al Brīţānī lish Sharq al Awsaţ,25.2643,55.29326,bank,Dubai,,United Arab Emirates,VCU,Natural Feature,,,,,,3
comment,2025-07-27,1,The fertility rate in Gaza is closer to 3-4 but it used to be above 6 in previous generations.,Gaza,31.50161,34.46672,seat of a first-order administrative division,Gaza Strip,Gaza,Palestinian Territory,VCU,City,,,,,,16
comment,2025-07-25,2,VCU is not in NoVa though...,Nova,64.48632,11.0805,valley,Trøndelag,Namsos,Norway,VCU,Natural Feature,,,,,,1
comment,2025-07-26,1,"New Mex, cali, Oregon, Washington, Maine, Montana, N.Dak, Wyoming, Nebraska, Indiana, Virginia, and im tired of typing, so a few NE states.",Health Centers of Northern New Mex Roy Clinic,35.94392,-104.18776,hospital,New Mexico,Harding County,United States,VCU,Building,,,,,,1
comment,2025-07-26,1,"New Mex, cali, Oregon, Washington, Maine, Montana, N.Dak, Wyoming, Nebraska, Indiana, Virginia, and im tired of typing, so a few NE states.",Chali,40.88208,44.10553,canyon,Lori,,Armenia,VCU,Natural Feature,,,,,,1
comment,2025-07-26,1,"New Mex, cali, Oregon, Washington, Maine, Montana, N.Dak, Wyoming, Nebraska, Indiana, Virginia, and im tired of typing, so a few NE states.",Oregon,44.00013,-120.50139,first-order administrative division,Oregon,,United States,VCU,State,,,,,,1
comment,2025-07-26,1,"New Mex, cali, Oregon, Washington, Maine, Montana, N.Dak, Wyoming, Nebraska, Indiana, Virginia, and im tired of typing, so a few NE states.",Washington County,41.53104,-96.22203,second-order administrative division,Nebraska,Washington County,United States,VCU,State,,,,,,1
comment,2025-07-26,1,"New Mex, cali, Oregon, Washington, Maine, Montana, N.Dak, Wyoming, Nebraska, Indiana, Virginia, and im tired of typing, so a few NE states.",Maine,45.50032,-69.24977,first-order administrative division,Maine,,United States,VCU,State,,,,,,1
comment,2025-07-26,1,"New Mex, cali, Oregon, Washington, Maine, Montana, N.Dak, Wyoming, Nebraska, Indiana, Virginia, and im tired of typing, so a few NE states.",Montana,47.00025,-109.75102,first-order administrative division,Montana,,United States,VCU,State,,,,,,1
comment,2025-07-26,1,"New Mex, cali, Oregon, Washington, Maine, Montana, N.Dak, Wyoming, Nebraska, Indiana, Virginia, and im tired of typing, so a few NE states.",Wyoming,43.00024,-107.5009,first-order administrative division,Wyoming,,United States,VCU,State,,,,,,1
comment,2025-07-26,1,"New Mex, cali, Oregon, Washington, Maine, Montana, N.Dak, Wyoming, Nebraska, Indiana, Virginia, and im tired of typing, so a few NE states.",Nebraska,41.50028,-99.75067,first-order administrative division,Nebraska,,United States,VCU,State,,,,,,2
comment,2025-07-26,1,"New Mex, cali, Oregon, Washington, Maine, Montana, N.Dak, Wyoming, Nebraska, Indiana, Virginia, and im tired of typing, so a few NE states.",Indiana,40.00032,-86.25027,first-order administrative division,Indiana,,United States,VCU,State,,,,,,1
comment,2025-07-26,1,"New Mex, cali, Oregon, Washington, Maine, Montana, N.Dak, Wyoming, Nebraska, Indiana, Virginia, and im tired of typing, so a few NE states.",Virginia,37.54812,-77.44675,first-order administrative division,Virginia,,United States,VCU,State,,,,,,58
comment,2025-07-26,1,"New Mex, cali, Oregon, Washington, Maine, Montana, N.Dak, Wyoming, Nebraska, Indiana, Virginia, and im tired of typing, so a few NE states.",Nebraska,41.50028,-99.75067,first-order administrative division,Nebraska,,United States,VCU,State,,,,,,2
comment,2025-07-24,6,"How do *you* define genocide, where did you get *your* definition from (cite sources), and why do you feel that Israel's destruction of Gazan people, territory, infrastructure, government, and culture fails to rise to your definition of genocide?",State of Israel,31.5,34.75,independent political entity,,,Israel,VCU,Country,,,,,,30
comment,2025-07-26,1,"Just like everything coming out of Palestine, take the real number and multiply by 10-20.",Palestine,31.92157,35.20329,semi-independent political entity,,,Palestinian Territory,VCU,Country,,,,,,25
comment,2026-02-15,10,"These changes were approved by the State Council of Higher Education for Virginia (SCHEV) last fall and will take effect July 1, 2026.",Virginia,37.54812,-77.44675,first-order administrative division,Virginia,,United States,VCU,State,,,,,,58
comment,2023-10-17,7,"I got launched to Jupiter by a giant there, I’d be careful if I were you",Jupiter,-20.91598,55.57914,populated place,,,Reunion,VCU,City,,,,,,1
comment,2024-01-22,49,I miss it and Richmond dearly.,Richmond,37.55376,-77.46026,seat of a first-order administrative division,Virginia,City of Richmond,United States,VCU,City,,,,,,183
comment,2024-01-23,8,VCU isn't one of those college towns where its the middle of nowhere like Harrisonburg (JMU).,City of Harrisonburg,38.44957,-78.86892,second-order administrative division,Virginia,City of Harrisonburg,United States,VCU,State,,,,,,2
comment,2024-01-23,8,VCU isn't one of those college towns where its the middle of nowhere like Harrisonburg (JMU).,Jiamusi,46.79711,130.31118,seat of a second-order administrative division,Heilongjiang,Jiamusi Shi,China,VCU,City,,,,,,2
comment,2024-01-23,8,"A lot of people who attend VCU are from the surrounding counties and Richmond itself, and those students were already friends from high school.",Richmond,37.55376,-77.46026,seat of a first-order administrative division,Virginia,City of Richmond,United States,VCU,City,,,,,,183
comment,2024-01-23,4,Study at some different coffee shops and look for event by bell isle.,Belleisle,18.295,-78.17966,section of populated place,Westmoreland,Fullersfield,Jamaica,VCU,Neighborhood,,,,,,1
comment,2024-01-23,4,I also think that there was way less to do Harrisonburg and so it kind of forced the student body to develop an internal community.,City of Harrisonburg,38.44957,-78.86892,second-order administrative division,Virginia,City of Harrisonburg,United States,VCU,State,,,,,,2
comment,2024-01-23,1,"If anyone is reading this and wants to chat, dm me, I'm into a lot of nerd stuff, rap / local music, and I want to do more stuff in richmond this year!",Richmond,39.82894,-84.89024,seat of a second-order administrative division,Indiana,Wayne County,United States,VCU,City,,,,,,7
comment,2024-01-24,1,I was from a small NW VA town where most people went to UVA/VT.,Virginia,37.54812,-77.44675,first-order administrative division,Virginia,,United States,VCU,State,,,,,,58
comment,2025-03-04,14,Rao has shaken hands with fascists who were at Jan6 and Charlottesville.,Charlottesville,38.02931,-78.47668,seat of a second-order administrative division,Virginia,City of Charlottesville,United States,VCU,City,,,,,,6
comment,2025-03-04,14,"Say a bunch of ridiculous shit, like what he's saying here, or the 51st state of Canada, both ridiculous and most likely won't happen, but it's a good diversion tactic for the mass public who doesn't really understand how things work, get them stirred up and waste their time worrying about nonsense while they make the real moves that'll put anyone working class or below down, eventually.... That's my take away from what I'm seeing here, anyway.",Canada,60.10867,-113.64258,independent political entity,,,Canada,VCU,Country,,,,,,1
comment,2025-03-04,2,"Also Monroe Park belongs to the city, not VCU, so students can just assemble pretty much anywhere across the street from campus to avoid VCU rules.",Monroe Park,37.54654,-77.45026,park,Virginia,City of Richmond,United States,VCU,Neighborhood,,,,,,4
comment,2025-03-04,2,Idk how permits work and rules for assembly or protests in Richmond tho.,Richmond,37.55376,-77.46026,seat of a first-order administrative division,Virginia,City of Richmond,United States,VCU,City,,,,,,183
comment,2020-08-20,10,The people who decide to put both the student body and the larger population of Richmond at risk just to have a good time deserve to be out of here.,Richmond,37.55376,-77.46026,seat of a first-order administrative division,Virginia,City of Richmond,United States,VCU,City,,,,,,183
comment,2020-08-20,2,They’re the ones having parties on campus despite being aware that the US has over 170K deaths now due to the virus and that we’ve been in this pandemic for 8 months now.,United States,39.76,-98.5,independent political entity,,,United States,VCU,Country,,,,,,51
comment,2025-05-11,32,"Free Palestine, fuck VCU",Palestine,31.92157,35.20329,semi-independent political entity,,,Palestinian Territory,VCU,Country,,,,,,25
comment,2025-05-12,2,Do people understand Palestine is anti LGBTQ and Israel is pro LGBTQ?,Palestine,31.92157,35.20329,semi-independent political entity,,,Palestinian Territory,VCU,Country,,,,,,25
comment,2025-05-12,2,Do people understand Palestine is anti LGBTQ and Israel is pro LGBTQ?,State of Israel,31.5,34.75,independent political entity,,,Israel,VCU,Country,,,,,,30
comment,2025-05-12,2,"They kill you in Palestine for being gay, yet I see a lot of people who are gay in support for a country that wouldn’t allow them to be there and may even execute them.",Palestine,31.92157,35.20329,semi-independent political entity,,,Palestinian Territory,VCU,Country,,,,,,25
comment,2025-05-14,1,"The attack by Hamas was horrible, but the IDF's bombing of refugees and preventing basic supplies like food, water, and medicine from Gaza is horrible as well.",Gaza,31.50161,34.46672,seat of a first-order administrative division,Gaza Strip,Gaza,Palestinian Territory,VCU,City,,,,,,16
comment,2025-05-10,-14,It’s interesting because I would assume their view points on almost every major societal issue are in direct conflict with the vast majority of the people living in Palestine and certainly the ones governing it.,Palestine,31.92157,35.20329,semi-independent political entity,,,Palestinian Territory,VCU,Country,,,,,,25
comment,2025-05-15,1,Free Palestine from Hamas,Palestine,31.92157,35.20329,semi-independent political entity,,,Palestinian Territory,VCU,Country,,,,,,25
comment,2025-05-12,-12,Viva Israel!,State of Israel,31.5,34.75,independent political entity,,,Israel,VCU,Country,,,,,,30
comment,2024-03-23,1,TIL Extreme Pizza isn’t just a Bay Area thing,San Francisco Bay Area,37.77239,-122.42349,economic region,California,,United States,VCU,Region,,,,,,1
comment,2024-03-24,1,I was actually at a rave show last year in Richmond and saw some familiar faces from my time at VCU lol.,Richmond,37.55376,-77.46026,seat of a first-order administrative division,Virginia,City of Richmond,United States,VCU,City,,,,,,183
comment,2024-03-24,1,"It’s weird, but ever since all of my friends from VCU left and moved out after graduating, Richmond just doesn’t have the same vibe for me anymore whenever I visit.",Richmond,37.55376,-77.46026,seat of a first-order administrative division,Virginia,City of Richmond,United States,VCU,City,,,,,,183
comment,2025-04-16,2,They don’t pay taxes and own half of Richmond city proper … soooo what did you expect?,Richmond,37.55376,-77.46026,seat of a first-order administrative division,Virginia,City of Richmond,United States,VCU,City,,,,,,183
comment,2025-04-16,2,The White House is trying to shut Harvard out of 2 billion for allowing protests.. VCU wants to keep funding to buy more of Richmond,Richmond,37.55376,-77.46026,seat of a first-order administrative division,Virginia,City of Richmond,United States,VCU,City,,,,,,183
comment,2025-01-31,5,VCU health is a huge non-profit that serves the majority of the indigent population of Richmond.,Richmond,37.55376,-77.46026,seat of a first-order administrative division,Virginia,City of Richmond,United States,VCU,City,,,,,,183
comment,2025-01-31,-6,Good work Virginia,Virginia,37.54812,-77.44675,first-order administrative division,Virginia,,United States,VCU,State,,,,,,58
comment,2025-01-31,2,"Mind you, the points you made don't stand or aren't comparable when you remember that this is HEALTHCARE we're talking about here, not bodily harm like with smoking or going to war, and in Virginia parents CAN consent to giving their child a tattoo and drink alcohol at private residences.",Virginia,37.54812,-77.44675,first-order administrative division,Virginia,,United States,VCU,State,,,,,,58
post,2024-10-08,264,Pro-Palestine VCU students march through Richmond to protest war in Gaza,Richmond,37.55376,-77.46026,seat of a first-order administrative division,Virginia,City of Richmond,United States,VCU,City,,,,,,183
post,2024-10-08,264,Pro-Palestine VCU students march through Richmond to protest war in Gaza,Gaza,31.50161,34.46672,seat of a first-order administrative division,Gaza Strip,Gaza,Palestinian Territory,VCU,City,,,,,,16
comment,2024-10-08,14,"I’m not going to solve Israel-Palestine in Reddit comments and neither are any of you, so please stop attacking Jewish people who have the “gall” to speak their minds on the subject.",State of Israel,31.5,34.75,independent political entity,,,Israel,VCU,Country,,,,,,30
comment,2024-10-08,31,"Israel has acted badly in its conduct of the war in Gaza, but its pretty objectionable that this pro-Gaza protest happened on the anniversary of the Oct 7th attacks.",State of Israel,31.5,34.75,independent political entity,,,Israel,VCU,Country,,,,,,30
comment,2024-10-08,31,"Israel has acted badly in its conduct of the war in Gaza, but its pretty objectionable that this pro-Gaza protest happened on the anniversary of the Oct 7th attacks.",Gaza,31.50161,34.46672,seat of a first-order administrative division,Gaza Strip,Gaza,Palestinian Territory,VCU,City,,,,,,16
comment,2024-10-09,5,Protests in favor of Palestine on the anniversary of a terrorist attack?,Palestine,31.92157,35.20329,semi-independent political entity,,,Palestinian Territory,VCU,Country,,,,,,25
comment,2024-10-09,4,The students should be more guided in their protests and aim their anger at the Israeli Likud govt and not Israel in general as the majority of Israelis don’t support what Netanyahu is doing and are protesting him and the Likud govt party who are failing the Israelis.,State of Israel,31.5,34.75,independent political entity,,,Israel,VCU,Country,,,,,,30
comment,2024-10-09,4,Student protesters need to wake up and realize who is causing the trouble in Israel- The Likud party and their corrupt leader and Hamas who stole the govt from the Palestinians not the moderate majority of the Israeli population who don’t condone what the Likud party is doing and making moderate Israel look bad fueling antisemitism with the way they are handling the war.,State of Israel,31.5,34.75,independent political entity,,,Israel,VCU,Country,,,,,,30
comment,2024-10-09,4,Things are always more complicated than protesting against Israel’s actions and being Pro Palestinian both of their governments are corrupt and are misguiding people’s actions on both sides.,State of Israel,31.5,34.75,independent political entity,,,Israel,VCU,Country,,,,,,30
comment,2024-10-08,3,"Firstly, Imagine if the Afghan people or even Afghanistan had done 9/11 (my recollection is that is was funded by Saudi Arabia and I can't remember who did it but we, being the American people, definitely used it as an excuse for extensive islamaphobia).",Islamic Republic of Afghanistan,33.0,66.0,independent political entity,,,Afghanistan,VCU,Country,,,,,,1
comment,2024-10-08,3,"Firstly, Imagine if the Afghan people or even Afghanistan had done 9/11 (my recollection is that is was funded by Saudi Arabia and I can't remember who did it but we, being the American people, definitely used it as an excuse for extensive islamaphobia).",Kingdom of Saudi Arabia,25.0,45.0,independent political entity,,,Saudi Arabia,VCU,Country,,,,,,1
comment,2024-10-08,3,"ETA: you can look at the attacks on October 7th as a prison break, if that helps (Palestine is colloquially referred to as the world's largest outdoor prison; Israel has quite a breadth of restrictions on what's allowed in and has a multi-tiered legal system with identification cards.",Palestine,31.92157,35.20329,semi-independent political entity,,,Palestinian Territory,VCU,Country,,,,,,25
comment,2024-10-08,3,"ETA: you can look at the attacks on October 7th as a prison break, if that helps (Palestine is colloquially referred to as the world's largest outdoor prison; Israel has quite a breadth of restrictions on what's allowed in and has a multi-tiered legal system with identification cards.",State of Israel,31.5,34.75,independent political entity,,,Israel,VCU,Country,,,,,,30
comment,2024-10-09,0,"this is like saying germany didn’t do the holocaust, only hitler and the ruling nazi party.",Federal Republic of Germany,51.5,10.5,independent political entity,,,Germany,VCU,Country,,,,,,1
comment,2024-10-09,0,"if the israeli population didn’t support the genocide, there wouldn’t be settlers in the west bank literally [stopping aid trucks](https://www.washingtonpost.com/world/2024/05/26/west-bank-aid-trucks-gaza-settlers/) and [destroying the aid](https://www.aa.com.tr/en/middle-east/illegal-israeli-settlers-block-aid-trucks-from-west-bank-to-besieged-gaza/3220387) set for gaza; israelis wouldn’t posting and bragging about things such as [blowing up the water reserve in rafah in celebration of shabbat](https://www.middleeastmonitor.com/20240729-israel-blowing-up-of-drinking-water-reservoir-crime-against-humanity-rafah-municipality/amp/), actually [beheading babies](https://www.instagram.com/reel/C7Kwk2vyus9/?igsh=MXZ2M203anA3cHV1cQ==) and [children](https://youtu.be/UNdI_KMpCew), [looting homes](https://www.972mag.com/israeli-soldiers-looting-gaza/) and [wearing/playing with displaced and possibly murdered palestinian women’s lingerie](https://www.reuters.com/world/middle-east/israeli-soldiers-play-with-gaza-womens-underwear-online-posts-2024-03-28/); [39% of Israelis say Israel’s military response against Hamas in Gaza has been about right, while 34% say it has not gone far enough and 19% think it has gone too far](https://www.pewresearch.org/global/2024/05/30/israeli-views-of-the-israel-hamas-war/) 

also, stop trying to pit hamas and israel on similar levels of “badness.” israel is committing a genocide against a civilian population and now expanding it into other countries.",Gaza,31.50161,34.46672,seat of a first-order administrative division,Gaza Strip,Gaza,Palestinian Territory,VCU,City,,,,,,16
